[
  {
    "url": "https://atbu.edu.ng/",
    "name": "atbu_edu_ng_",
    "file": "atbu_edu_ng_.report.json",
    "html": "atbu_edu_ng_.report.html",
    "csv": "atbu_edu_ng_.report.csv",
    "score": 0.66,
    "detail": {
      "performance": 0.6,
      "accessibility": 0.73,
      "best-practices": 0.87,
      "seo": 0.69,
      "pwa": 0.42
    }
  },
  {
    "url": "https://abu.edu.ng/",
    "name": "abu_edu_ng_",
    "file": "abu_edu_ng_.report.json",
    "html": "abu_edu_ng_.report.html",
    "csv": "abu_edu_ng_.report.csv",
    "score": 0.65,
    "detail": {
      "performance": 0.32,
      "accessibility": 0.85,
      "best-practices": 0.87,
      "seo": 0.77,
      "pwa": 0.42
    }
  },
  {
    "url": "https://afit.edu/",
    "name": "afit_edu_",
    "file": "afit_edu_.report.json",
    "html": "afit_edu_.report.html",
    "csv": "afit_edu_.report.csv",
    "score": 0,
    "error": "Thu, 10 Feb 2022 18:07:00 GMT LH:ChromeLauncher Waiting for browser.\nThu, 10 Feb 2022 18:07:00 GMT LH:ChromeLauncher Waiting for browser...\nThu, 10 Feb 2022 18:07:01 GMT LH:ChromeLauncher Waiting for browser.....\nThu, 10 Feb 2022 18:07:01 GMT LH:ChromeLauncher Waiting for browser.....\u001b[32m✓\u001b[0m\nThu, 10 Feb 2022 18:07:01 GMT LH:config:warn IFrameElements gatherer requested, however no audit requires it.\nThu, 10 Feb 2022 18:07:01 GMT LH:config:warn FormElements gatherer requested, however no audit requires it.\nThu, 10 Feb 2022 18:07:01 GMT LH:status Connecting to browser\nThu, 10 Feb 2022 18:07:01 GMT LH:status Resetting state with about:blank\nThu, 10 Feb 2022 18:07:01 GMT LH:status Navigating to about:blank\nThu, 10 Feb 2022 18:07:01 GMT LH:status Benchmarking machine\nThu, 10 Feb 2022 18:07:02 GMT LH:status Initializing…\nThu, 10 Feb 2022 18:07:02 GMT LH:status Preparing target for navigation mode\nThu, 10 Feb 2022 18:07:02 GMT LH:status Running defaultPass pass CSSUsage, JsUsage, ViewportDimensions, ConsoleMessages, AnchorElements, ImageElements, LinkElements, MetaElements, ScriptElements, IFrameElements, FormElements, MainDocumentContent, GlobalListeners, AppCacheManifest, Doctype, DOMStats, OptimizedImages, PasswordInputsWithPreventedPaste, ResponseCompression, TagsBlockingFirstPaint, FontSize, EmbeddedContent, RobotsTxt, TapTargets, Accessibility, TraceElements, InspectorIssues, SourceMaps, FullPageScreenshot\nThu, 10 Feb 2022 18:07:02 GMT LH:status Resetting state with about:blank\nThu, 10 Feb 2022 18:07:02 GMT LH:status Navigating to about:blank\nThu, 10 Feb 2022 18:07:02 GMT LH:status Preparing target for navigation\nThu, 10 Feb 2022 18:07:02 GMT LH:status Cleaning origin data\nThu, 10 Feb 2022 18:07:02 GMT LH:status Cleaning browser cache\nThu, 10 Feb 2022 18:07:02 GMT LH:status Preparing network conditions\nThu, 10 Feb 2022 18:07:02 GMT LH:status Beginning devtoolsLog and trace\nThu, 10 Feb 2022 18:07:02 GMT LH:status Loading page & waiting for onload\nThu, 10 Feb 2022 18:07:02 GMT LH:status Navigating to https://afit.edu/\nThu, 10 Feb 2022 18:07:32 GMT LH:status Gathering in-page: CSSUsage\nThu, 10 Feb 2022 18:07:32 GMT LH:status Gathering in-page: JsUsage\nThu, 10 Feb 2022 18:07:32 GMT LH:status Gathering in-page: ViewportDimensions\nThu, 10 Feb 2022 18:07:32 GMT LH:status Gathering in-page: ConsoleMessages\nThu, 10 Feb 2022 18:07:32 GMT LH:status Gathering in-page: AnchorElements\nThu, 10 Feb 2022 18:07:32 GMT LH:status Gathering in-page: ImageElements\nThu, 10 Feb 2022 18:07:32 GMT LH:status Gathering in-page: LinkElements\nThu, 10 Feb 2022 18:07:32 GMT LH:status Gathering in-page: MetaElements\nThu, 10 Feb 2022 18:07:32 GMT LH:status Gathering in-page: ScriptElements\nThu, 10 Feb 2022 18:07:32 GMT LH:status Gathering in-page: IFrameElements\nThu, 10 Feb 2022 18:07:32 GMT LH:status Gathering in-page: FormElements\nThu, 10 Feb 2022 18:07:32 GMT LH:status Gathering in-page: MainDocumentContent\nThu, 10 Feb 2022 18:07:32 GMT LH:status Gathering in-page: GlobalListeners\nThu, 10 Feb 2022 18:07:32 GMT LH:status Gathering in-page: AppCacheManifest\nThu, 10 Feb 2022 18:07:32 GMT LH:status Gathering in-page: Doctype\nThu, 10 Feb 2022 18:07:32 GMT LH:status Gathering in-page: DOMStats\nThu, 10 Feb 2022 18:07:32 GMT LH:status Gathering in-page: OptimizedImages\nThu, 10 Feb 2022 18:07:32 GMT LH:status Gathering in-page: PasswordInputsWithPreventedPaste\nThu, 10 Feb 2022 18:07:32 GMT LH:status Gathering in-page: ResponseCompression\nThu, 10 Feb 2022 18:07:32 GMT LH:status Gathering in-page: TagsBlockingFirstPaint\nThu, 10 Feb 2022 18:07:32 GMT LH:status Gathering in-page: FontSize\nThu, 10 Feb 2022 18:07:32 GMT LH:status Gathering in-page: EmbeddedContent\nThu, 10 Feb 2022 18:07:32 GMT LH:status Gathering in-page: RobotsTxt\nThu, 10 Feb 2022 18:07:32 GMT LH:status Gathering in-page: TapTargets\nThu, 10 Feb 2022 18:07:32 GMT LH:status Gathering in-page: Accessibility\nThu, 10 Feb 2022 18:07:32 GMT LH:status Gathering in-page: TraceElements\nThu, 10 Feb 2022 18:07:32 GMT LH:status Gathering in-page: InspectorIssues\nThu, 10 Feb 2022 18:07:32 GMT LH:status Gathering in-page: SourceMaps\nThu, 10 Feb 2022 18:07:32 GMT LH:status Gathering in-page: FullPageScreenshot\nThu, 10 Feb 2022 18:07:32 GMT LH:status Gathering trace\nThu, 10 Feb 2022 18:07:32 GMT LH:status Gathering devtoolsLog & network records\nThu, 10 Feb 2022 18:07:33 GMT LH:GatherRunner:error The page provided is not HTML (served as MIME type ). https://afit.edu/\nThu, 10 Feb 2022 18:07:33 GMT LH:status Disconnecting from browser...\nThu, 10 Feb 2022 18:07:33 GMT LH:status Cleaning origin data\nThu, 10 Feb 2022 18:07:33 GMT LH:status Analyzing and running audits...\nThu, 10 Feb 2022 18:07:33 GMT LH:status Auditing: Uses HTTPS\nThu, 10 Feb 2022 18:07:33 GMT LH:Runner:warn devtoolsLogs gatherer, required by audit is-on-https, did not run.\nThu, 10 Feb 2022 18:07:33 GMT LH:status Auditing: Redirects HTTP traffic to HTTPS\nThu, 10 Feb 2022 18:07:33 GMT LH:Runner:warn HTTPRedirect gatherer, required by audit redirects-http, did not run.\nThu, 10 Feb 2022 18:07:33 GMT LH:status Auditing: Registers a service worker that controls page and `start_url`\nThu, 10 Feb 2022 18:07:33 GMT LH:Runner:warn ServiceWorker gatherer, required by audit service-worker, did not run.\nThu, 10 Feb 2022 18:07:33 GMT LH:status Auditing: Has a `<meta name=\"viewport\">` tag with `width` or `initial-scale`\nThu, 10 Feb 2022 18:07:33 GMT LH:Runner:warn MetaElements gatherer, required by audit viewport, did not run.\nThu, 10 Feb 2022 18:07:33 GMT LH:status Auditing: First Contentful Paint\nThu, 10 Feb 2022 18:07:33 GMT LH:Runner:warn traces gatherer, required by audit first-contentful-paint, did not run.\nThu, 10 Feb 2022 18:07:33 GMT LH:status Auditing: Largest Contentful Paint\nThu, 10 Feb 2022 18:07:33 GMT LH:Runner:warn traces gatherer, required by audit largest-contentful-paint, did not run.\nThu, 10 Feb 2022 18:07:33 GMT LH:status Auditing: First Meaningful Paint\nThu, 10 Feb 2022 18:07:33 GMT LH:Runner:warn traces gatherer, required by audit first-meaningful-paint, did not run.\nThu, 10 Feb 2022 18:07:33 GMT LH:status Auditing: Speed Index\nThu, 10 Feb 2022 18:07:33 GMT LH:Runner:warn traces gatherer, required by audit speed-index, did not run.\nThu, 10 Feb 2022 18:07:33 GMT LH:status Auditing: Screenshot Thumbnails\nThu, 10 Feb 2022 18:07:33 GMT LH:Runner:warn traces gatherer, required by audit screenshot-thumbnails, did not run.\nThu, 10 Feb 2022 18:07:33 GMT LH:status Auditing: Final Screenshot\nThu, 10 Feb 2022 18:07:33 GMT LH:Runner:warn traces gatherer, required by audit final-screenshot, did not run.\nThu, 10 Feb 2022 18:07:33 GMT LH:status Auditing: Total Blocking Time\nThu, 10 Feb 2022 18:07:33 GMT LH:Runner:warn traces gatherer, required by audit total-blocking-time, did not run.\nThu, 10 Feb 2022 18:07:33 GMT LH:status Auditing: Max Potential First Input Delay\nThu, 10 Feb 2022 18:07:33 GMT LH:Runner:warn traces gatherer, required by audit max-potential-fid, did not run.\nThu, 10 Feb 2022 18:07:33 GMT LH:status Auditing: Cumulative Layout Shift\nThu, 10 Feb 2022 18:07:33 GMT LH:Runner:warn traces gatherer, required by audit cumulative-layout-shift, did not run.\nThu, 10 Feb 2022 18:07:33 GMT LH:status Auditing: No browser errors logged to the console\nThu, 10 Feb 2022 18:07:33 GMT LH:Runner:warn ConsoleMessages gatherer, required by audit errors-in-console, did not run.\nThu, 10 Feb 2022 18:07:33 GMT LH:status Auditing: Initial server response time was short\nThu, 10 Feb 2022 18:07:33 GMT LH:Runner:warn devtoolsLogs gatherer, required by audit server-response-time, did not run.\nThu, 10 Feb 2022 18:07:33 GMT LH:status Auditing: Time to Interactive\nThu, 10 Feb 2022 18:07:33 GMT LH:Runner:warn traces gatherer, required by audit interactive, did not run.\nThu, 10 Feb 2022 18:07:33 GMT LH:status Auditing: User Timing marks and measures\nThu, 10 Feb 2022 18:07:33 GMT LH:Runner:warn traces gatherer, required by audit user-timings, did not run.\nThu, 10 Feb 2022 18:07:33 GMT LH:status Auditing: Avoid chaining critical requests\nThu, 10 Feb 2022 18:07:33 GMT LH:Runner:warn traces gatherer, required by audit critical-request-chains, did not run.\nThu, 10 Feb 2022 18:07:33 GMT LH:status Auditing: Avoid multiple page redirects\nThu, 10 Feb 2022 18:07:33 GMT LH:Runner:warn devtoolsLogs gatherer, required by audit redirects, did not run.\nThu, 10 Feb 2022 18:07:33 GMT LH:status Auditing: Web app manifest and service worker meet the installability requirements\nThu, 10 Feb 2022 18:07:33 GMT LH:status Auditing: Provides a valid `apple-touch-icon`\nThu, 10 Feb 2022 18:07:33 GMT LH:Runner:warn LinkElements gatherer, required by audit apple-touch-icon, did not run.\nThu, 10 Feb 2022 18:07:33 GMT LH:status Auditing: Configured for a custom splash screen\nThu, 10 Feb 2022 18:07:33 GMT LH:status Auditing: Sets a theme color for the address bar.\nThu, 10 Feb 2022 18:07:33 GMT LH:Runner:warn MetaElements gatherer, required by audit themed-omnibox, did not run.\nThu, 10 Feb 2022 18:07:33 GMT LH:status Auditing: Manifest has a maskable icon\nThu, 10 Feb 2022 18:07:33 GMT LH:status Auditing: Content is sized correctly for the viewport\nThu, 10 Feb 2022 18:07:33 GMT LH:Runner:warn ViewportDimensions gatherer, required by audit content-width, did not run.\nThu, 10 Feb 2022 18:07:33 GMT LH:status Auditing: Displays images with correct aspect ratio\nThu, 10 Feb 2022 18:07:33 GMT LH:Runner:warn ImageElements gatherer, required by audit image-aspect-ratio, did not run.\nThu, 10 Feb 2022 18:07:33 GMT LH:status Auditing: Serves images with appropriate resolution\nThu, 10 Feb 2022 18:07:33 GMT LH:Runner:warn ImageElements gatherer, required by audit image-size-responsive, did not run.\nThu, 10 Feb 2022 18:07:33 GMT LH:status Auditing: Fonts with `font-display: optional` are preloaded\nThu, 10 Feb 2022 18:07:33 GMT LH:Runner:warn devtoolsLogs gatherer, required by audit preload-fonts, did not run.\nThu, 10 Feb 2022 18:07:33 GMT LH:status Auditing: Avoids deprecated APIs\nThu, 10 Feb 2022 18:07:33 GMT LH:Runner:warn ConsoleMessages gatherer, required by audit deprecations, did not run.\nThu, 10 Feb 2022 18:07:33 GMT LH:status Auditing: Minimizes main-thread work\nThu, 10 Feb 2022 18:07:33 GMT LH:Runner:warn traces gatherer, required by audit mainthread-work-breakdown, did not run.\nThu, 10 Feb 2022 18:07:33 GMT LH:status Auditing: JavaScript execution time\nThu, 10 Feb 2022 18:07:33 GMT LH:Runner:warn traces gatherer, required by audit bootup-time, did not run.\nThu, 10 Feb 2022 18:07:33 GMT LH:status Auditing: Preload key requests\nThu, 10 Feb 2022 18:07:33 GMT LH:Runner:warn devtoolsLogs gatherer, required by audit uses-rel-preload, did not run.\nThu, 10 Feb 2022 18:07:33 GMT LH:status Auditing: Preconnect to required origins\nThu, 10 Feb 2022 18:07:33 GMT LH:Runner:warn traces gatherer, required by audit uses-rel-preconnect, did not run.\nThu, 10 Feb 2022 18:07:33 GMT LH:status Auditing: All text remains visible during webfont loads\nThu, 10 Feb 2022 18:07:33 GMT LH:Runner:warn devtoolsLogs gatherer, required by audit font-display, did not run.\nThu, 10 Feb 2022 18:07:33 GMT LH:status Auditing: Diagnostics\nThu, 10 Feb 2022 18:07:33 GMT LH:Runner:warn traces gatherer, required by audit diagnostics, did not run.\nThu, 10 Feb 2022 18:07:33 GMT LH:status Auditing: Network Requests\nThu, 10 Feb 2022 18:07:33 GMT LH:Runner:warn devtoolsLogs gatherer, required by audit network-requests, did not run.\nThu, 10 Feb 2022 18:07:33 GMT LH:status Auditing: Network Round Trip Times\nThu, 10 Feb 2022 18:07:33 GMT LH:Runner:warn devtoolsLogs gatherer, required by audit network-rtt, did not run.\nThu, 10 Feb 2022 18:07:33 GMT LH:status Auditing: Server Backend Latencies\nThu, 10 Feb 2022 18:07:33 GMT LH:Runner:warn devtoolsLogs gatherer, required by audit network-server-latency, did not run.\nThu, 10 Feb 2022 18:07:33 GMT LH:status Auditing: Tasks\nThu, 10 Feb 2022 18:07:33 GMT LH:Runner:warn traces gatherer, required by audit main-thread-tasks, did not run.\nThu, 10 Feb 2022 18:07:33 GMT LH:status Auditing: Metrics\nThu, 10 Feb 2022 18:07:33 GMT LH:Runner:warn traces gatherer, required by audit metrics, did not run.\nThu, 10 Feb 2022 18:07:33 GMT LH:status Auditing: Performance budget\nThu, 10 Feb 2022 18:07:33 GMT LH:Runner:warn devtoolsLogs gatherer, required by audit performance-budget, did not run.\nThu, 10 Feb 2022 18:07:33 GMT LH:status Auditing: Timing budget\nThu, 10 Feb 2022 18:07:33 GMT LH:Runner:warn devtoolsLogs gatherer, required by audit timing-budget, did not run.\nThu, 10 Feb 2022 18:07:33 GMT LH:status Auditing: Keep request counts low and transfer sizes small\nThu, 10 Feb 2022 18:07:33 GMT LH:Runner:warn devtoolsLogs gatherer, required by audit resource-summary, did not run.\nThu, 10 Feb 2022 18:07:33 GMT LH:status Auditing: Minimize third-party usage\nThu, 10 Feb 2022 18:07:33 GMT LH:Runner:warn traces gatherer, required by audit third-party-summary, did not run.\nThu, 10 Feb 2022 18:07:33 GMT LH:status Auditing: Lazy load third-party resources with facades\nThu, 10 Feb 2022 18:07:33 GMT LH:Runner:warn traces gatherer, required by audit third-party-facades, did not run.\nThu, 10 Feb 2022 18:07:33 GMT LH:status Auditing: Largest Contentful Paint element\nThu, 10 Feb 2022 18:07:33 GMT LH:Runner:warn traces gatherer, required by audit largest-contentful-paint-element, did not run.\nThu, 10 Feb 2022 18:07:33 GMT LH:status Auditing: Largest Contentful Paint image was not lazily loaded\nThu, 10 Feb 2022 18:07:33 GMT LH:Runner:warn TraceElements gatherer, required by audit lcp-lazy-loaded, did not run.\nThu, 10 Feb 2022 18:07:33 GMT LH:status Auditing: Avoid large layout shifts\nThu, 10 Feb 2022 18:07:33 GMT LH:Runner:warn traces gatherer, required by audit layout-shift-elements, did not run.\nThu, 10 Feb 2022 18:07:33 GMT LH:status Auditing: Avoid long main-thread tasks\nThu, 10 Feb 2022 18:07:33 GMT LH:Runner:warn traces gatherer, required by audit long-tasks, did not run.\nThu, 10 Feb 2022 18:07:33 GMT LH:status Auditing: Avoids `unload` event listeners\nThu, 10 Feb 2022 18:07:33 GMT LH:Runner:warn GlobalListeners gatherer, required by audit no-unload-listeners, did not run.\nThu, 10 Feb 2022 18:07:33 GMT LH:status Auditing: Avoid non-composited animations\nThu, 10 Feb 2022 18:07:33 GMT LH:Runner:warn TraceElements gatherer, required by audit non-composited-animations, did not run.\nThu, 10 Feb 2022 18:07:33 GMT LH:status Auditing: Image elements have explicit `width` and `height`\nThu, 10 Feb 2022 18:07:33 GMT LH:Runner:warn ImageElements gatherer, required by audit unsized-images, did not run.\nThu, 10 Feb 2022 18:07:33 GMT LH:status Auditing: Page has valid source maps\nThu, 10 Feb 2022 18:07:33 GMT LH:Runner:warn ScriptElements gatherer, required by audit valid-source-maps, did not run.\nThu, 10 Feb 2022 18:07:33 GMT LH:status Auditing: Preload Largest Contentful Paint image\nThu, 10 Feb 2022 18:07:33 GMT LH:Runner:warn traces gatherer, required by audit preload-lcp-image, did not run.\nThu, 10 Feb 2022 18:07:33 GMT LH:status Auditing: Ensure CSP is effective against XSS attacks\nThu, 10 Feb 2022 18:07:33 GMT LH:Runner:warn devtoolsLogs gatherer, required by audit csp-xss, did not run.\nThu, 10 Feb 2022 18:07:33 GMT LH:status Auditing: Full-page screenshot\nThu, 10 Feb 2022 18:07:33 GMT LH:Runner:warn FullPageScreenshot gatherer, required by audit full-page-screenshot, did not run.\nThu, 10 Feb 2022 18:07:33 GMT LH:status Auditing: Script Treemap Data\nThu, 10 Feb 2022 18:07:33 GMT LH:Runner:warn traces gatherer, required by audit script-treemap-data, did not run.\nThu, 10 Feb 2022 18:07:33 GMT LH:status Auditing: Site works cross-browser\nThu, 10 Feb 2022 18:07:33 GMT LH:status Auditing: Page transitions don't feel like they block on the network\nThu, 10 Feb 2022 18:07:33 GMT LH:status Auditing: Each page has a URL\nThu, 10 Feb 2022 18:07:33 GMT LH:status Auditing: `[accesskey]` values are unique\nThu, 10 Feb 2022 18:07:33 GMT LH:Runner:warn Accessibility gatherer, required by audit accesskeys, did not run.\nThu, 10 Feb 2022 18:07:33 GMT LH:status Auditing: `[aria-*]` attributes match their roles\nThu, 10 Feb 2022 18:07:33 GMT LH:Runner:warn Accessibility gatherer, required by audit aria-allowed-attr, did not run.\nThu, 10 Feb 2022 18:07:33 GMT LH:status Auditing: `button`, `link`, and `menuitem` elements have accessible names\nThu, 10 Feb 2022 18:07:33 GMT LH:Runner:warn Accessibility gatherer, required by audit aria-command-name, did not run.\nThu, 10 Feb 2022 18:07:33 GMT LH:status Auditing: `[aria-hidden=\"true\"]` is not present on the document `<body>`\nThu, 10 Feb 2022 18:07:33 GMT LH:Runner:warn Accessibility gatherer, required by audit aria-hidden-body, did not run.\nThu, 10 Feb 2022 18:07:33 GMT LH:status Auditing: `[aria-hidden=\"true\"]` elements do not contain focusable descendents\nThu, 10 Feb 2022 18:07:33 GMT LH:Runner:warn Accessibility gatherer, required by audit aria-hidden-focus, did not run.\nThu, 10 Feb 2022 18:07:33 GMT LH:status Auditing: ARIA input fields have accessible names\nThu, 10 Feb 2022 18:07:33 GMT LH:Runner:warn Accessibility gatherer, required by audit aria-input-field-name, did not run.\nThu, 10 Feb 2022 18:07:33 GMT LH:status Auditing: ARIA `meter` elements have accessible names\nThu, 10 Feb 2022 18:07:33 GMT LH:Runner:warn Accessibility gatherer, required by audit aria-meter-name, did not run.\nThu, 10 Feb 2022 18:07:33 GMT LH:status Auditing: ARIA `progressbar` elements have accessible names\nThu, 10 Feb 2022 18:07:33 GMT LH:Runner:warn Accessibility gatherer, required by audit aria-progressbar-name, did not run.\nThu, 10 Feb 2022 18:07:33 GMT LH:status Auditing: `[role]`s have all required `[aria-*]` attributes\nThu, 10 Feb 2022 18:07:33 GMT LH:Runner:warn Accessibility gatherer, required by audit aria-required-attr, did not run.\nThu, 10 Feb 2022 18:07:33 GMT LH:status Auditing: Elements with an ARIA `[role]` that require children to contain a specific `[role]` have all required children.\nThu, 10 Feb 2022 18:07:33 GMT LH:Runner:warn Accessibility gatherer, required by audit aria-required-children, did not run.\nThu, 10 Feb 2022 18:07:33 GMT LH:status Auditing: `[role]`s are contained by their required parent element\nThu, 10 Feb 2022 18:07:33 GMT LH:Runner:warn Accessibility gatherer, required by audit aria-required-parent, did not run.\nThu, 10 Feb 2022 18:07:33 GMT LH:status Auditing: `[role]` values are valid\nThu, 10 Feb 2022 18:07:33 GMT LH:Runner:warn Accessibility gatherer, required by audit aria-roles, did not run.\nThu, 10 Feb 2022 18:07:33 GMT LH:status Auditing: ARIA toggle fields have accessible names\nThu, 10 Feb 2022 18:07:33 GMT LH:Runner:warn Accessibility gatherer, required by audit aria-toggle-field-name, did not run.\nThu, 10 Feb 2022 18:07:33 GMT LH:status Auditing: ARIA `tooltip` elements have accessible names\nThu, 10 Feb 2022 18:07:33 GMT LH:Runner:warn Accessibility gatherer, required by audit aria-tooltip-name, did not run.\nThu, 10 Feb 2022 18:07:33 GMT LH:status Auditing: ARIA `treeitem` elements have accessible names\nThu, 10 Feb 2022 18:07:33 GMT LH:Runner:warn Accessibility gatherer, required by audit aria-treeitem-name, did not run.\nThu, 10 Feb 2022 18:07:33 GMT LH:status Auditing: `[aria-*]` attributes have valid values\nThu, 10 Feb 2022 18:07:33 GMT LH:Runner:warn Accessibility gatherer, required by audit aria-valid-attr-value, did not run.\nThu, 10 Feb 2022 18:07:33 GMT LH:status Auditing: `[aria-*]` attributes are valid and not misspelled\nThu, 10 Feb 2022 18:07:33 GMT LH:Runner:warn Accessibility gatherer, required by audit aria-valid-attr, did not run.\nThu, 10 Feb 2022 18:07:33 GMT LH:status Auditing: Buttons have an accessible name\nThu, 10 Feb 2022 18:07:33 GMT LH:Runner:warn Accessibility gatherer, required by audit button-name, did not run.\nThu, 10 Feb 2022 18:07:33 GMT LH:status Auditing: The page contains a heading, skip link, or landmark region\nThu, 10 Feb 2022 18:07:33 GMT LH:Runner:warn Accessibility gatherer, required by audit bypass, did not run.\nThu, 10 Feb 2022 18:07:33 GMT LH:status Auditing: Background and foreground colors have a sufficient contrast ratio\nThu, 10 Feb 2022 18:07:33 GMT LH:Runner:warn Accessibility gatherer, required by audit color-contrast, did not run.\nThu, 10 Feb 2022 18:07:33 GMT LH:status Auditing: `<dl>`'s contain only properly-ordered `<dt>` and `<dd>` groups, `<script>`, `<template>` or `<div>` elements.\nThu, 10 Feb 2022 18:07:33 GMT LH:Runner:warn Accessibility gatherer, required by audit definition-list, did not run.\nThu, 10 Feb 2022 18:07:33 GMT LH:status Auditing: Definition list items are wrapped in `<dl>` elements\nThu, 10 Feb 2022 18:07:33 GMT LH:Runner:warn Accessibility gatherer, required by audit dlitem, did not run.\nThu, 10 Feb 2022 18:07:33 GMT LH:status Auditing: Document has a `<title>` element\nThu, 10 Feb 2022 18:07:33 GMT LH:Runner:warn Accessibility gatherer, required by audit document-title, did not run.\nThu, 10 Feb 2022 18:07:33 GMT LH:status Auditing: `[id]` attributes on active, focusable elements are unique\nThu, 10 Feb 2022 18:07:33 GMT LH:Runner:warn Accessibility gatherer, required by audit duplicate-id-active, did not run.\nThu, 10 Feb 2022 18:07:33 GMT LH:status Auditing: ARIA IDs are unique\nThu, 10 Feb 2022 18:07:33 GMT LH:Runner:warn Accessibility gatherer, required by audit duplicate-id-aria, did not run.\nThu, 10 Feb 2022 18:07:33 GMT LH:status Auditing: No form fields have multiple labels\nThu, 10 Feb 2022 18:07:33 GMT LH:Runner:warn Accessibility gatherer, required by audit form-field-multiple-labels, did not run.\nThu, 10 Feb 2022 18:07:33 GMT LH:status Auditing: `<frame>` or `<iframe>` elements have a title\nThu, 10 Feb 2022 18:07:33 GMT LH:Runner:warn Accessibility gatherer, required by audit frame-title, did not run.\nThu, 10 Feb 2022 18:07:33 GMT LH:status Auditing: Heading elements appear in a sequentially-descending order\nThu, 10 Feb 2022 18:07:33 GMT LH:Runner:warn Accessibility gatherer, required by audit heading-order, did not run.\nThu, 10 Feb 2022 18:07:33 GMT LH:status Auditing: `<html>` element has a `[lang]` attribute\nThu, 10 Feb 2022 18:07:33 GMT LH:Runner:warn Accessibility gatherer, required by audit html-has-lang, did not run.\nThu, 10 Feb 2022 18:07:33 GMT LH:status Auditing: `<html>` element has a valid value for its `[lang]` attribute\nThu, 10 Feb 2022 18:07:33 GMT LH:Runner:warn Accessibility gatherer, required by audit html-lang-valid, did not run.\nThu, 10 Feb 2022 18:07:33 GMT LH:status Auditing: Image elements have `[alt]` attributes\nThu, 10 Feb 2022 18:07:33 GMT LH:Runner:warn Accessibility gatherer, required by audit image-alt, did not run.\nThu, 10 Feb 2022 18:07:33 GMT LH:status Auditing: `<input type=\"image\">` elements have `[alt]` text\nThu, 10 Feb 2022 18:07:33 GMT LH:Runner:warn Accessibility gatherer, required by audit input-image-alt, did not run.\nThu, 10 Feb 2022 18:07:33 GMT LH:status Auditing: Form elements have associated labels\nThu, 10 Feb 2022 18:07:33 GMT LH:Runner:warn Accessibility gatherer, required by audit label, did not run.\nThu, 10 Feb 2022 18:07:33 GMT LH:status Auditing: Links have a discernible name\nThu, 10 Feb 2022 18:07:33 GMT LH:Runner:warn Accessibility gatherer, required by audit link-name, did not run.\nThu, 10 Feb 2022 18:07:33 GMT LH:status Auditing: Lists contain only `<li>` elements and script supporting elements (`<script>` and `<template>`).\nThu, 10 Feb 2022 18:07:33 GMT LH:Runner:warn Accessibility gatherer, required by audit list, did not run.\nThu, 10 Feb 2022 18:07:33 GMT LH:status Auditing: List items (`<li>`) are contained within `<ul>` or `<ol>` parent elements\nThu, 10 Feb 2022 18:07:33 GMT LH:Runner:warn Accessibility gatherer, required by audit listitem, did not run.\nThu, 10 Feb 2022 18:07:33 GMT LH:status Auditing: The document does not use `<meta http-equiv=\"refresh\">`\nThu, 10 Feb 2022 18:07:33 GMT LH:Runner:warn Accessibility gatherer, required by audit meta-refresh, did not run.\nThu, 10 Feb 2022 18:07:33 GMT LH:status Auditing: `[user-scalable=\"no\"]` is not used in the `<meta name=\"viewport\">` element and the `[maximum-scale]` attribute is not less than 5.\nThu, 10 Feb 2022 18:07:33 GMT LH:Runner:warn Accessibility gatherer, required by audit meta-viewport, did not run.\nThu, 10 Feb 2022 18:07:33 GMT LH:status Auditing: `<object>` elements have `[alt]` text\nThu, 10 Feb 2022 18:07:33 GMT LH:Runner:warn Accessibility gatherer, required by audit object-alt, did not run.\nThu, 10 Feb 2022 18:07:33 GMT LH:status Auditing: No element has a `[tabindex]` value greater than 0\nThu, 10 Feb 2022 18:07:33 GMT LH:Runner:warn Accessibility gatherer, required by audit tabindex, did not run.\nThu, 10 Feb 2022 18:07:33 GMT LH:status Auditing: Cells in a `<table>` element that use the `[headers]` attribute refer to table cells within the same table.\nThu, 10 Feb 2022 18:07:33 GMT LH:Runner:warn Accessibility gatherer, required by audit td-headers-attr, did not run.\nThu, 10 Feb 2022 18:07:33 GMT LH:status Auditing: `<th>` elements and elements with `[role=\"columnheader\"/\"rowheader\"]` have data cells they describe.\nThu, 10 Feb 2022 18:07:33 GMT LH:Runner:warn Accessibility gatherer, required by audit th-has-data-cells, did not run.\nThu, 10 Feb 2022 18:07:33 GMT LH:status Auditing: `[lang]` attributes have a valid value\nThu, 10 Feb 2022 18:07:33 GMT LH:Runner:warn Accessibility gatherer, required by audit valid-lang, did not run.\nThu, 10 Feb 2022 18:07:33 GMT LH:status Auditing: `<video>` elements contain a `<track>` element with `[kind=\"captions\"]`\nThu, 10 Feb 2022 18:07:33 GMT LH:Runner:warn Accessibility gatherer, required by audit video-caption, did not run.\nThu, 10 Feb 2022 18:07:33 GMT LH:status Auditing: Custom controls have associated labels\nThu, 10 Feb 2022 18:07:33 GMT LH:status Auditing: Custom controls have ARIA roles\nThu, 10 Feb 2022 18:07:33 GMT LH:status Auditing: User focus is not accidentally trapped in a region\nThu, 10 Feb 2022 18:07:33 GMT LH:status Auditing: Interactive controls are keyboard focusable\nThu, 10 Feb 2022 18:07:33 GMT LH:status Auditing: Interactive elements indicate their purpose and state\nThu, 10 Feb 2022 18:07:33 GMT LH:status Auditing: The page has a logical tab order\nThu, 10 Feb 2022 18:07:33 GMT LH:status Auditing: The user's focus is directed to new content added to the page\nThu, 10 Feb 2022 18:07:33 GMT LH:status Auditing: Offscreen content is hidden from assistive technology\nThu, 10 Feb 2022 18:07:33 GMT LH:status Auditing: HTML5 landmark elements are used to improve navigation\nThu, 10 Feb 2022 18:07:33 GMT LH:status Auditing: Visual order on the page follows DOM order\nThu, 10 Feb 2022 18:07:33 GMT LH:status Auditing: Uses efficient cache policy on static assets\nThu, 10 Feb 2022 18:07:33 GMT LH:Runner:warn devtoolsLogs gatherer, required by audit uses-long-cache-ttl, did not run.\nThu, 10 Feb 2022 18:07:33 GMT LH:status Auditing: Avoids enormous network payloads\nThu, 10 Feb 2022 18:07:33 GMT LH:Runner:warn devtoolsLogs gatherer, required by audit total-byte-weight, did not run.\nThu, 10 Feb 2022 18:07:33 GMT LH:status Auditing: Defer offscreen images\nThu, 10 Feb 2022 18:07:33 GMT LH:Runner:warn ImageElements gatherer, required by audit offscreen-images, did not run.\nThu, 10 Feb 2022 18:07:33 GMT LH:status Auditing: Eliminate render-blocking resources\nThu, 10 Feb 2022 18:07:33 GMT LH:Runner:warn TagsBlockingFirstPaint gatherer, required by audit render-blocking-resources, did not run.\nThu, 10 Feb 2022 18:07:33 GMT LH:status Auditing: Minify CSS\nThu, 10 Feb 2022 18:07:33 GMT LH:Runner:warn CSSUsage gatherer, required by audit unminified-css, did not run.\nThu, 10 Feb 2022 18:07:33 GMT LH:status Auditing: Minify JavaScript\nThu, 10 Feb 2022 18:07:33 GMT LH:Runner:warn ScriptElements gatherer, required by audit unminified-javascript, did not run.\nThu, 10 Feb 2022 18:07:33 GMT LH:status Auditing: Reduce unused CSS\nThu, 10 Feb 2022 18:07:33 GMT LH:Runner:warn CSSUsage gatherer, required by audit unused-css-rules, did not run.\nThu, 10 Feb 2022 18:07:33 GMT LH:status Auditing: Reduce unused JavaScript\nThu, 10 Feb 2022 18:07:33 GMT LH:Runner:warn JsUsage gatherer, required by audit unused-javascript, did not run.\nThu, 10 Feb 2022 18:07:33 GMT LH:status Auditing: Serve images in next-gen formats\nThu, 10 Feb 2022 18:07:33 GMT LH:Runner:warn OptimizedImages gatherer, required by audit modern-image-formats, did not run.\nThu, 10 Feb 2022 18:07:33 GMT LH:status Auditing: Efficiently encode images\nThu, 10 Feb 2022 18:07:33 GMT LH:Runner:warn OptimizedImages gatherer, required by audit uses-optimized-images, did not run.\nThu, 10 Feb 2022 18:07:33 GMT LH:status Auditing: Enable text compression\nThu, 10 Feb 2022 18:07:33 GMT LH:Runner:warn ResponseCompression gatherer, required by audit uses-text-compression, did not run.\nThu, 10 Feb 2022 18:07:33 GMT LH:status Auditing: Properly size images\nThu, 10 Feb 2022 18:07:33 GMT LH:Runner:warn ImageElements gatherer, required by audit uses-responsive-images, did not run.\nThu, 10 Feb 2022 18:07:33 GMT LH:status Auditing: Use video formats for animated content\nThu, 10 Feb 2022 18:07:33 GMT LH:Runner:warn devtoolsLogs gatherer, required by audit efficient-animated-content, did not run.\nThu, 10 Feb 2022 18:07:33 GMT LH:status Auditing: Remove duplicate modules in JavaScript bundles\nThu, 10 Feb 2022 18:07:33 GMT LH:Runner:warn devtoolsLogs gatherer, required by audit duplicated-javascript, did not run.\nThu, 10 Feb 2022 18:07:33 GMT LH:status Auditing: Avoid serving legacy JavaScript to modern browsers\nThu, 10 Feb 2022 18:07:33 GMT LH:Runner:warn devtoolsLogs gatherer, required by audit legacy-javascript, did not run.\nThu, 10 Feb 2022 18:07:33 GMT LH:status Auditing: Avoids Application Cache\nThu, 10 Feb 2022 18:07:33 GMT LH:Runner:warn AppCacheManifest gatherer, required by audit appcache-manifest, did not run.\nThu, 10 Feb 2022 18:07:33 GMT LH:status Auditing: Page has the HTML doctype\nThu, 10 Feb 2022 18:07:33 GMT LH:Runner:warn Doctype gatherer, required by audit doctype, did not run.\nThu, 10 Feb 2022 18:07:33 GMT LH:status Auditing: Properly defines charset\nThu, 10 Feb 2022 18:07:33 GMT LH:Runner:warn MainDocumentContent gatherer, required by audit charset, did not run.\nThu, 10 Feb 2022 18:07:33 GMT LH:status Auditing: Avoids an excessive DOM size\nThu, 10 Feb 2022 18:07:33 GMT LH:Runner:warn DOMStats gatherer, required by audit dom-size, did not run.\nThu, 10 Feb 2022 18:07:33 GMT LH:status Auditing: Links to cross-origin destinations are safe\nThu, 10 Feb 2022 18:07:33 GMT LH:Runner:warn AnchorElements gatherer, required by audit external-anchors-use-rel-noopener, did not run.\nThu, 10 Feb 2022 18:07:33 GMT LH:status Auditing: Avoids requesting the geolocation permission on page load\nThu, 10 Feb 2022 18:07:33 GMT LH:Runner:warn ConsoleMessages gatherer, required by audit geolocation-on-start, did not run.\nThu, 10 Feb 2022 18:07:33 GMT LH:status Auditing: No issues in the `Issues` panel in Chrome Devtools\nThu, 10 Feb 2022 18:07:33 GMT LH:Runner:warn InspectorIssues gatherer, required by audit inspector-issues, did not run.\nThu, 10 Feb 2022 18:07:33 GMT LH:status Auditing: Avoids `document.write()`\nThu, 10 Feb 2022 18:07:33 GMT LH:Runner:warn ConsoleMessages gatherer, required by audit no-document-write, did not run.\nThu, 10 Feb 2022 18:07:33 GMT LH:status Auditing: Avoids front-end JavaScript libraries with known security vulnerabilities\nThu, 10 Feb 2022 18:07:33 GMT LH:status Auditing: Detected JavaScript libraries\nThu, 10 Feb 2022 18:07:33 GMT LH:status Auditing: Avoids requesting the notification permission on page load\nThu, 10 Feb 2022 18:07:33 GMT LH:Runner:warn ConsoleMessages gatherer, required by audit notification-on-start, did not run.\nThu, 10 Feb 2022 18:07:33 GMT LH:status Auditing: Allows users to paste into password fields\nThu, 10 Feb 2022 18:07:33 GMT LH:Runner:warn PasswordInputsWithPreventedPaste gatherer, required by audit password-inputs-can-be-pasted-into, did not run.\nThu, 10 Feb 2022 18:07:33 GMT LH:status Auditing: Use HTTP/2\nThu, 10 Feb 2022 18:07:33 GMT LH:Runner:warn devtoolsLogs gatherer, required by audit uses-http2, did not run.\nThu, 10 Feb 2022 18:07:33 GMT LH:status Auditing: Uses passive listeners to improve scrolling performance\nThu, 10 Feb 2022 18:07:33 GMT LH:Runner:warn ConsoleMessages gatherer, required by audit uses-passive-event-listeners, did not run.\nThu, 10 Feb 2022 18:07:33 GMT LH:status Auditing: Document has a meta description\nThu, 10 Feb 2022 18:07:33 GMT LH:Runner:warn MetaElements gatherer, required by audit meta-description, did not run.\nThu, 10 Feb 2022 18:07:33 GMT LH:status Auditing: Page has successful HTTP status code\nThu, 10 Feb 2022 18:07:33 GMT LH:Runner:warn devtoolsLogs gatherer, required by audit http-status-code, did not run.\nThu, 10 Feb 2022 18:07:33 GMT LH:status Auditing: Document uses legible font sizes\nThu, 10 Feb 2022 18:07:33 GMT LH:Runner:warn FontSize gatherer, required by audit font-size, did not run.\nThu, 10 Feb 2022 18:07:33 GMT LH:status Auditing: Links have descriptive text\nThu, 10 Feb 2022 18:07:33 GMT LH:Runner:warn AnchorElements gatherer, required by audit link-text, did not run.\nThu, 10 Feb 2022 18:07:33 GMT LH:status Auditing: Links are crawlable\nThu, 10 Feb 2022 18:07:33 GMT LH:Runner:warn AnchorElements gatherer, required by audit crawlable-anchors, did not run.\nThu, 10 Feb 2022 18:07:33 GMT LH:status Auditing: Page isn’t blocked from indexing\nThu, 10 Feb 2022 18:07:33 GMT LH:Runner:warn MetaElements gatherer, required by audit is-crawlable, did not run.\nThu, 10 Feb 2022 18:07:33 GMT LH:status Auditing: robots.txt is valid\nThu, 10 Feb 2022 18:07:33 GMT LH:Runner:warn RobotsTxt gatherer, required by audit robots-txt, did not run.\nThu, 10 Feb 2022 18:07:33 GMT LH:status Auditing: Tap targets are sized appropriately\nThu, 10 Feb 2022 18:07:33 GMT LH:Runner:warn MetaElements gatherer, required by audit tap-targets, did not run.\nThu, 10 Feb 2022 18:07:33 GMT LH:status Auditing: Document has a valid `hreflang`\nThu, 10 Feb 2022 18:07:33 GMT LH:Runner:warn LinkElements gatherer, required by audit hreflang, did not run.\nThu, 10 Feb 2022 18:07:33 GMT LH:status Auditing: Document avoids plugins\nThu, 10 Feb 2022 18:07:33 GMT LH:Runner:warn EmbeddedContent gatherer, required by audit plugins, did not run.\nThu, 10 Feb 2022 18:07:33 GMT LH:status Auditing: Document has a valid `rel=canonical`\nThu, 10 Feb 2022 18:07:33 GMT LH:Runner:warn LinkElements gatherer, required by audit canonical, did not run.\nThu, 10 Feb 2022 18:07:33 GMT LH:status Auditing: Structured data is valid\nThu, 10 Feb 2022 18:07:33 GMT LH:status Generating results...\nThu, 10 Feb 2022 18:07:33 GMT LH:Printer json output written to /Users/bolajiayodeji/Tunnel/csc422_eval/report/afit_edu_.report.json\nThu, 10 Feb 2022 18:07:33 GMT LH:Printer html output written to /Users/bolajiayodeji/Tunnel/csc422_eval/report/afit_edu_.report.html\nThu, 10 Feb 2022 18:07:33 GMT LH:CLI Protip: Run lighthouse with `--view` to immediately open the HTML report in your browser\nThu, 10 Feb 2022 18:07:33 GMT LH:Printer csv output written to /Users/bolajiayodeji/Tunnel/csc422_eval/report/afit_edu_.report.csv\nThu, 10 Feb 2022 18:07:33 GMT LH:ChromeLauncher Killing Chrome instance 8224\nRuntime error encountered: The page provided is not HTML (served as MIME type ).\n"
  },
  {
    "url": "https://buk.edu.ng/",
    "name": "buk_edu_ng_",
    "file": "buk_edu_ng_.report.json",
    "html": "buk_edu_ng_.report.html",
    "csv": "buk_edu_ng_.report.csv",
    "score": 0.62,
    "detail": {
      "performance": 0.41,
      "accessibility": 0.82,
      "best-practices": 0.87,
      "seo": 0.76,
      "pwa": 0.25
    }
  },
  {
    "url": "https://fugashua.edu.ng/",
    "name": "fugashua_edu_ng_",
    "file": "fugashua_edu_ng_.report.json",
    "html": "fugashua_edu_ng_.report.html",
    "csv": "fugashua_edu_ng_.report.csv",
    "score": 0.68,
    "detail": {
      "performance": 0.38,
      "accessibility": 0.94,
      "best-practices": 0.73,
      "seo": 0.92,
      "pwa": 0.42
    }
  },
  {
    "url": "https://unaab.edu.ng/",
    "name": "unaab_edu_ng_",
    "file": "unaab_edu_ng_.report.json",
    "html": "unaab_edu_ng_.report.html",
    "csv": "unaab_edu_ng_.report.csv",
    "score": 0.62,
    "detail": {
      "performance": 0.36,
      "accessibility": 0.78,
      "best-practices": 0.8,
      "seo": 0.67,
      "pwa": 0.5
    }
  },
  {
    "url": "https://uam.edu.ng/",
    "name": "uam_edu_ng_",
    "file": "uam_edu_ng_.report.json",
    "html": "uam_edu_ng_.report.html",
    "csv": "uam_edu_ng_.report.csv",
    "score": 0.59,
    "detail": {
      "performance": 0.36,
      "accessibility": 0.72,
      "best-practices": 0.6,
      "seo": 0.95,
      "pwa": 0.33
    }
  },
  {
    "url": "https://futo.edu.ng/",
    "name": "futo_edu_ng_",
    "file": "futo_edu_ng_.report.json",
    "html": "futo_edu_ng_.report.html",
    "csv": "futo_edu_ng_.report.csv",
    "score": 0.67,
    "detail": {
      "performance": 0.25,
      "accessibility": 0.9,
      "best-practices": 0.8,
      "seo": 0.88,
      "pwa": 0.5
    }
  },
  {
    "url": "https://fubk.edu.ng/",
    "name": "fubk_edu_ng_",
    "file": "fubk_edu_ng_.report.json",
    "html": "fubk_edu_ng_.report.html",
    "csv": "fubk_edu_ng_.report.csv",
    "score": 0.63,
    "detail": {
      "performance": 0.4,
      "accessibility": 0.83,
      "best-practices": 0.67,
      "seo": 0.84,
      "pwa": 0.42
    }
  },
  {
    "url": "https://fudutsinma.edu.ng/",
    "name": "fudutsinma_edu_ng_",
    "file": "fudutsinma_edu_ng_.report.json",
    "html": "fudutsinma_edu_ng_.report.html",
    "csv": "fudutsinma_edu_ng_.report.csv",
    "score": 0,
    "error": "Thu, 10 Feb 2022 18:11:59 GMT LH:ChromeLauncher Waiting for browser.\nThu, 10 Feb 2022 18:11:59 GMT LH:ChromeLauncher Waiting for browser...\nThu, 10 Feb 2022 18:12:00 GMT LH:ChromeLauncher Waiting for browser.....\nThu, 10 Feb 2022 18:12:00 GMT LH:ChromeLauncher Waiting for browser.....\u001b[32m✓\u001b[0m\nThu, 10 Feb 2022 18:12:00 GMT LH:config:warn IFrameElements gatherer requested, however no audit requires it.\nThu, 10 Feb 2022 18:12:00 GMT LH:config:warn FormElements gatherer requested, however no audit requires it.\nThu, 10 Feb 2022 18:12:00 GMT LH:status Connecting to browser\nThu, 10 Feb 2022 18:12:00 GMT LH:status Resetting state with about:blank\nThu, 10 Feb 2022 18:12:00 GMT LH:status Navigating to about:blank\nThu, 10 Feb 2022 18:12:00 GMT LH:status Benchmarking machine\nThu, 10 Feb 2022 18:12:01 GMT LH:status Initializing…\nThu, 10 Feb 2022 18:12:01 GMT LH:status Preparing target for navigation mode\nThu, 10 Feb 2022 18:12:01 GMT LH:status Running defaultPass pass CSSUsage, JsUsage, ViewportDimensions, ConsoleMessages, AnchorElements, ImageElements, LinkElements, MetaElements, ScriptElements, IFrameElements, FormElements, MainDocumentContent, GlobalListeners, AppCacheManifest, Doctype, DOMStats, OptimizedImages, PasswordInputsWithPreventedPaste, ResponseCompression, TagsBlockingFirstPaint, FontSize, EmbeddedContent, RobotsTxt, TapTargets, Accessibility, TraceElements, InspectorIssues, SourceMaps, FullPageScreenshot\nThu, 10 Feb 2022 18:12:01 GMT LH:status Resetting state with about:blank\nThu, 10 Feb 2022 18:12:01 GMT LH:status Navigating to about:blank\nThu, 10 Feb 2022 18:12:01 GMT LH:status Preparing target for navigation\nThu, 10 Feb 2022 18:12:01 GMT LH:status Cleaning origin data\nThu, 10 Feb 2022 18:12:01 GMT LH:status Cleaning browser cache\nThu, 10 Feb 2022 18:12:01 GMT LH:status Preparing network conditions\nThu, 10 Feb 2022 18:12:01 GMT LH:status Beginning devtoolsLog and trace\nThu, 10 Feb 2022 18:12:01 GMT LH:status Loading page & waiting for onload\nThu, 10 Feb 2022 18:12:01 GMT LH:status Navigating to https://fudutsinma.edu.ng/\nThu, 10 Feb 2022 18:12:31 GMT LH:status Gathering in-page: CSSUsage\nThu, 10 Feb 2022 18:12:31 GMT LH:status Gathering in-page: JsUsage\nThu, 10 Feb 2022 18:12:31 GMT LH:status Gathering in-page: ViewportDimensions\nThu, 10 Feb 2022 18:12:31 GMT LH:status Gathering in-page: ConsoleMessages\nThu, 10 Feb 2022 18:12:31 GMT LH:status Gathering in-page: AnchorElements\nThu, 10 Feb 2022 18:12:31 GMT LH:status Gathering in-page: ImageElements\nThu, 10 Feb 2022 18:12:31 GMT LH:status Gathering in-page: LinkElements\nThu, 10 Feb 2022 18:12:31 GMT LH:status Gathering in-page: MetaElements\nThu, 10 Feb 2022 18:12:31 GMT LH:status Gathering in-page: ScriptElements\nThu, 10 Feb 2022 18:12:31 GMT LH:status Gathering in-page: IFrameElements\nThu, 10 Feb 2022 18:12:31 GMT LH:status Gathering in-page: FormElements\nThu, 10 Feb 2022 18:12:31 GMT LH:status Gathering in-page: MainDocumentContent\nThu, 10 Feb 2022 18:12:31 GMT LH:status Gathering in-page: GlobalListeners\nThu, 10 Feb 2022 18:12:31 GMT LH:status Gathering in-page: AppCacheManifest\nThu, 10 Feb 2022 18:12:31 GMT LH:status Gathering in-page: Doctype\nThu, 10 Feb 2022 18:12:31 GMT LH:status Gathering in-page: DOMStats\nThu, 10 Feb 2022 18:12:31 GMT LH:status Gathering in-page: OptimizedImages\nThu, 10 Feb 2022 18:12:31 GMT LH:status Gathering in-page: PasswordInputsWithPreventedPaste\nThu, 10 Feb 2022 18:12:31 GMT LH:status Gathering in-page: ResponseCompression\nThu, 10 Feb 2022 18:12:31 GMT LH:status Gathering in-page: TagsBlockingFirstPaint\nThu, 10 Feb 2022 18:12:31 GMT LH:status Gathering in-page: FontSize\nThu, 10 Feb 2022 18:12:31 GMT LH:status Gathering in-page: EmbeddedContent\nThu, 10 Feb 2022 18:12:31 GMT LH:status Gathering in-page: RobotsTxt\nThu, 10 Feb 2022 18:12:31 GMT LH:status Gathering in-page: TapTargets\nThu, 10 Feb 2022 18:12:31 GMT LH:status Gathering in-page: Accessibility\nThu, 10 Feb 2022 18:12:31 GMT LH:status Gathering in-page: TraceElements\nThu, 10 Feb 2022 18:12:31 GMT LH:status Gathering in-page: InspectorIssues\nThu, 10 Feb 2022 18:12:31 GMT LH:status Gathering in-page: SourceMaps\nThu, 10 Feb 2022 18:12:31 GMT LH:status Gathering in-page: FullPageScreenshot\nThu, 10 Feb 2022 18:12:31 GMT LH:status Gathering trace\nThu, 10 Feb 2022 18:12:31 GMT LH:status Gathering devtoolsLog & network records\nThu, 10 Feb 2022 18:12:31 GMT LH:GatherRunner:error Lighthouse was unable to reliably load the page you requested. Make sure you are testing the correct URL and that the server is properly responding to all requests. (Details: net::ERR_CERT_COMMON_NAME_INVALID) https://fudutsinma.edu.ng/\nThu, 10 Feb 2022 18:12:31 GMT LH:status Disconnecting from browser...\nThu, 10 Feb 2022 18:12:31 GMT LH:status Cleaning origin data\nThu, 10 Feb 2022 18:12:31 GMT LH:status Analyzing and running audits...\nThu, 10 Feb 2022 18:12:31 GMT LH:status Auditing: Uses HTTPS\nThu, 10 Feb 2022 18:12:31 GMT LH:Runner:warn devtoolsLogs gatherer, required by audit is-on-https, did not run.\nThu, 10 Feb 2022 18:12:31 GMT LH:status Auditing: Redirects HTTP traffic to HTTPS\nThu, 10 Feb 2022 18:12:31 GMT LH:Runner:warn HTTPRedirect gatherer, required by audit redirects-http, did not run.\nThu, 10 Feb 2022 18:12:31 GMT LH:status Auditing: Registers a service worker that controls page and `start_url`\nThu, 10 Feb 2022 18:12:31 GMT LH:Runner:warn ServiceWorker gatherer, required by audit service-worker, did not run.\nThu, 10 Feb 2022 18:12:31 GMT LH:status Auditing: Has a `<meta name=\"viewport\">` tag with `width` or `initial-scale`\nThu, 10 Feb 2022 18:12:31 GMT LH:Runner:warn MetaElements gatherer, required by audit viewport, did not run.\nThu, 10 Feb 2022 18:12:31 GMT LH:status Auditing: First Contentful Paint\nThu, 10 Feb 2022 18:12:31 GMT LH:Runner:warn traces gatherer, required by audit first-contentful-paint, did not run.\nThu, 10 Feb 2022 18:12:31 GMT LH:status Auditing: Largest Contentful Paint\nThu, 10 Feb 2022 18:12:31 GMT LH:Runner:warn traces gatherer, required by audit largest-contentful-paint, did not run.\nThu, 10 Feb 2022 18:12:31 GMT LH:status Auditing: First Meaningful Paint\nThu, 10 Feb 2022 18:12:31 GMT LH:Runner:warn traces gatherer, required by audit first-meaningful-paint, did not run.\nThu, 10 Feb 2022 18:12:31 GMT LH:status Auditing: Speed Index\nThu, 10 Feb 2022 18:12:31 GMT LH:Runner:warn traces gatherer, required by audit speed-index, did not run.\nThu, 10 Feb 2022 18:12:31 GMT LH:status Auditing: Screenshot Thumbnails\nThu, 10 Feb 2022 18:12:31 GMT LH:Runner:warn traces gatherer, required by audit screenshot-thumbnails, did not run.\nThu, 10 Feb 2022 18:12:31 GMT LH:status Auditing: Final Screenshot\nThu, 10 Feb 2022 18:12:31 GMT LH:Runner:warn traces gatherer, required by audit final-screenshot, did not run.\nThu, 10 Feb 2022 18:12:31 GMT LH:status Auditing: Total Blocking Time\nThu, 10 Feb 2022 18:12:31 GMT LH:Runner:warn traces gatherer, required by audit total-blocking-time, did not run.\nThu, 10 Feb 2022 18:12:31 GMT LH:status Auditing: Max Potential First Input Delay\nThu, 10 Feb 2022 18:12:31 GMT LH:Runner:warn traces gatherer, required by audit max-potential-fid, did not run.\nThu, 10 Feb 2022 18:12:31 GMT LH:status Auditing: Cumulative Layout Shift\nThu, 10 Feb 2022 18:12:31 GMT LH:Runner:warn traces gatherer, required by audit cumulative-layout-shift, did not run.\nThu, 10 Feb 2022 18:12:31 GMT LH:status Auditing: No browser errors logged to the console\nThu, 10 Feb 2022 18:12:31 GMT LH:Runner:warn ConsoleMessages gatherer, required by audit errors-in-console, did not run.\nThu, 10 Feb 2022 18:12:31 GMT LH:status Auditing: Initial server response time was short\nThu, 10 Feb 2022 18:12:31 GMT LH:Runner:warn devtoolsLogs gatherer, required by audit server-response-time, did not run.\nThu, 10 Feb 2022 18:12:31 GMT LH:status Auditing: Time to Interactive\nThu, 10 Feb 2022 18:12:31 GMT LH:Runner:warn traces gatherer, required by audit interactive, did not run.\nThu, 10 Feb 2022 18:12:31 GMT LH:status Auditing: User Timing marks and measures\nThu, 10 Feb 2022 18:12:31 GMT LH:Runner:warn traces gatherer, required by audit user-timings, did not run.\nThu, 10 Feb 2022 18:12:31 GMT LH:status Auditing: Avoid chaining critical requests\nThu, 10 Feb 2022 18:12:31 GMT LH:Runner:warn traces gatherer, required by audit critical-request-chains, did not run.\nThu, 10 Feb 2022 18:12:31 GMT LH:status Auditing: Avoid multiple page redirects\nThu, 10 Feb 2022 18:12:31 GMT LH:Runner:warn devtoolsLogs gatherer, required by audit redirects, did not run.\nThu, 10 Feb 2022 18:12:31 GMT LH:status Auditing: Web app manifest and service worker meet the installability requirements\nThu, 10 Feb 2022 18:12:31 GMT LH:status Auditing: Provides a valid `apple-touch-icon`\nThu, 10 Feb 2022 18:12:31 GMT LH:Runner:warn LinkElements gatherer, required by audit apple-touch-icon, did not run.\nThu, 10 Feb 2022 18:12:31 GMT LH:status Auditing: Configured for a custom splash screen\nThu, 10 Feb 2022 18:12:31 GMT LH:status Auditing: Sets a theme color for the address bar.\nThu, 10 Feb 2022 18:12:31 GMT LH:Runner:warn MetaElements gatherer, required by audit themed-omnibox, did not run.\nThu, 10 Feb 2022 18:12:31 GMT LH:status Auditing: Manifest has a maskable icon\nThu, 10 Feb 2022 18:12:31 GMT LH:status Auditing: Content is sized correctly for the viewport\nThu, 10 Feb 2022 18:12:31 GMT LH:Runner:warn ViewportDimensions gatherer, required by audit content-width, did not run.\nThu, 10 Feb 2022 18:12:31 GMT LH:status Auditing: Displays images with correct aspect ratio\nThu, 10 Feb 2022 18:12:31 GMT LH:Runner:warn ImageElements gatherer, required by audit image-aspect-ratio, did not run.\nThu, 10 Feb 2022 18:12:31 GMT LH:status Auditing: Serves images with appropriate resolution\nThu, 10 Feb 2022 18:12:31 GMT LH:Runner:warn ImageElements gatherer, required by audit image-size-responsive, did not run.\nThu, 10 Feb 2022 18:12:31 GMT LH:status Auditing: Fonts with `font-display: optional` are preloaded\nThu, 10 Feb 2022 18:12:31 GMT LH:Runner:warn devtoolsLogs gatherer, required by audit preload-fonts, did not run.\nThu, 10 Feb 2022 18:12:31 GMT LH:status Auditing: Avoids deprecated APIs\nThu, 10 Feb 2022 18:12:31 GMT LH:Runner:warn ConsoleMessages gatherer, required by audit deprecations, did not run.\nThu, 10 Feb 2022 18:12:31 GMT LH:status Auditing: Minimizes main-thread work\nThu, 10 Feb 2022 18:12:31 GMT LH:Runner:warn traces gatherer, required by audit mainthread-work-breakdown, did not run.\nThu, 10 Feb 2022 18:12:31 GMT LH:status Auditing: JavaScript execution time\nThu, 10 Feb 2022 18:12:31 GMT LH:Runner:warn traces gatherer, required by audit bootup-time, did not run.\nThu, 10 Feb 2022 18:12:31 GMT LH:status Auditing: Preload key requests\nThu, 10 Feb 2022 18:12:31 GMT LH:Runner:warn devtoolsLogs gatherer, required by audit uses-rel-preload, did not run.\nThu, 10 Feb 2022 18:12:31 GMT LH:status Auditing: Preconnect to required origins\nThu, 10 Feb 2022 18:12:31 GMT LH:Runner:warn traces gatherer, required by audit uses-rel-preconnect, did not run.\nThu, 10 Feb 2022 18:12:31 GMT LH:status Auditing: All text remains visible during webfont loads\nThu, 10 Feb 2022 18:12:31 GMT LH:Runner:warn devtoolsLogs gatherer, required by audit font-display, did not run.\nThu, 10 Feb 2022 18:12:31 GMT LH:status Auditing: Diagnostics\nThu, 10 Feb 2022 18:12:31 GMT LH:Runner:warn traces gatherer, required by audit diagnostics, did not run.\nThu, 10 Feb 2022 18:12:31 GMT LH:status Auditing: Network Requests\nThu, 10 Feb 2022 18:12:31 GMT LH:Runner:warn devtoolsLogs gatherer, required by audit network-requests, did not run.\nThu, 10 Feb 2022 18:12:31 GMT LH:status Auditing: Network Round Trip Times\nThu, 10 Feb 2022 18:12:31 GMT LH:Runner:warn devtoolsLogs gatherer, required by audit network-rtt, did not run.\nThu, 10 Feb 2022 18:12:31 GMT LH:status Auditing: Server Backend Latencies\nThu, 10 Feb 2022 18:12:31 GMT LH:Runner:warn devtoolsLogs gatherer, required by audit network-server-latency, did not run.\nThu, 10 Feb 2022 18:12:31 GMT LH:status Auditing: Tasks\nThu, 10 Feb 2022 18:12:31 GMT LH:Runner:warn traces gatherer, required by audit main-thread-tasks, did not run.\nThu, 10 Feb 2022 18:12:31 GMT LH:status Auditing: Metrics\nThu, 10 Feb 2022 18:12:31 GMT LH:Runner:warn traces gatherer, required by audit metrics, did not run.\nThu, 10 Feb 2022 18:12:31 GMT LH:status Auditing: Performance budget\nThu, 10 Feb 2022 18:12:31 GMT LH:Runner:warn devtoolsLogs gatherer, required by audit performance-budget, did not run.\nThu, 10 Feb 2022 18:12:31 GMT LH:status Auditing: Timing budget\nThu, 10 Feb 2022 18:12:31 GMT LH:Runner:warn devtoolsLogs gatherer, required by audit timing-budget, did not run.\nThu, 10 Feb 2022 18:12:31 GMT LH:status Auditing: Keep request counts low and transfer sizes small\nThu, 10 Feb 2022 18:12:31 GMT LH:Runner:warn devtoolsLogs gatherer, required by audit resource-summary, did not run.\nThu, 10 Feb 2022 18:12:31 GMT LH:status Auditing: Minimize third-party usage\nThu, 10 Feb 2022 18:12:31 GMT LH:Runner:warn traces gatherer, required by audit third-party-summary, did not run.\nThu, 10 Feb 2022 18:12:31 GMT LH:status Auditing: Lazy load third-party resources with facades\nThu, 10 Feb 2022 18:12:31 GMT LH:Runner:warn traces gatherer, required by audit third-party-facades, did not run.\nThu, 10 Feb 2022 18:12:31 GMT LH:status Auditing: Largest Contentful Paint element\nThu, 10 Feb 2022 18:12:31 GMT LH:Runner:warn traces gatherer, required by audit largest-contentful-paint-element, did not run.\nThu, 10 Feb 2022 18:12:31 GMT LH:status Auditing: Largest Contentful Paint image was not lazily loaded\nThu, 10 Feb 2022 18:12:31 GMT LH:Runner:warn TraceElements gatherer, required by audit lcp-lazy-loaded, did not run.\nThu, 10 Feb 2022 18:12:31 GMT LH:status Auditing: Avoid large layout shifts\nThu, 10 Feb 2022 18:12:31 GMT LH:Runner:warn traces gatherer, required by audit layout-shift-elements, did not run.\nThu, 10 Feb 2022 18:12:31 GMT LH:status Auditing: Avoid long main-thread tasks\nThu, 10 Feb 2022 18:12:31 GMT LH:Runner:warn traces gatherer, required by audit long-tasks, did not run.\nThu, 10 Feb 2022 18:12:31 GMT LH:status Auditing: Avoids `unload` event listeners\nThu, 10 Feb 2022 18:12:31 GMT LH:Runner:warn GlobalListeners gatherer, required by audit no-unload-listeners, did not run.\nThu, 10 Feb 2022 18:12:31 GMT LH:status Auditing: Avoid non-composited animations\nThu, 10 Feb 2022 18:12:31 GMT LH:Runner:warn TraceElements gatherer, required by audit non-composited-animations, did not run.\nThu, 10 Feb 2022 18:12:31 GMT LH:status Auditing: Image elements have explicit `width` and `height`\nThu, 10 Feb 2022 18:12:31 GMT LH:Runner:warn ImageElements gatherer, required by audit unsized-images, did not run.\nThu, 10 Feb 2022 18:12:31 GMT LH:status Auditing: Page has valid source maps\nThu, 10 Feb 2022 18:12:31 GMT LH:Runner:warn ScriptElements gatherer, required by audit valid-source-maps, did not run.\nThu, 10 Feb 2022 18:12:31 GMT LH:status Auditing: Preload Largest Contentful Paint image\nThu, 10 Feb 2022 18:12:31 GMT LH:Runner:warn traces gatherer, required by audit preload-lcp-image, did not run.\nThu, 10 Feb 2022 18:12:31 GMT LH:status Auditing: Ensure CSP is effective against XSS attacks\nThu, 10 Feb 2022 18:12:31 GMT LH:Runner:warn devtoolsLogs gatherer, required by audit csp-xss, did not run.\nThu, 10 Feb 2022 18:12:31 GMT LH:status Auditing: Full-page screenshot\nThu, 10 Feb 2022 18:12:31 GMT LH:Runner:warn FullPageScreenshot gatherer, required by audit full-page-screenshot, did not run.\nThu, 10 Feb 2022 18:12:31 GMT LH:status Auditing: Script Treemap Data\nThu, 10 Feb 2022 18:12:31 GMT LH:Runner:warn traces gatherer, required by audit script-treemap-data, did not run.\nThu, 10 Feb 2022 18:12:31 GMT LH:status Auditing: Site works cross-browser\nThu, 10 Feb 2022 18:12:31 GMT LH:status Auditing: Page transitions don't feel like they block on the network\nThu, 10 Feb 2022 18:12:31 GMT LH:status Auditing: Each page has a URL\nThu, 10 Feb 2022 18:12:31 GMT LH:status Auditing: `[accesskey]` values are unique\nThu, 10 Feb 2022 18:12:31 GMT LH:Runner:warn Accessibility gatherer, required by audit accesskeys, did not run.\nThu, 10 Feb 2022 18:12:31 GMT LH:status Auditing: `[aria-*]` attributes match their roles\nThu, 10 Feb 2022 18:12:31 GMT LH:Runner:warn Accessibility gatherer, required by audit aria-allowed-attr, did not run.\nThu, 10 Feb 2022 18:12:31 GMT LH:status Auditing: `button`, `link`, and `menuitem` elements have accessible names\nThu, 10 Feb 2022 18:12:31 GMT LH:Runner:warn Accessibility gatherer, required by audit aria-command-name, did not run.\nThu, 10 Feb 2022 18:12:31 GMT LH:status Auditing: `[aria-hidden=\"true\"]` is not present on the document `<body>`\nThu, 10 Feb 2022 18:12:31 GMT LH:Runner:warn Accessibility gatherer, required by audit aria-hidden-body, did not run.\nThu, 10 Feb 2022 18:12:31 GMT LH:status Auditing: `[aria-hidden=\"true\"]` elements do not contain focusable descendents\nThu, 10 Feb 2022 18:12:31 GMT LH:Runner:warn Accessibility gatherer, required by audit aria-hidden-focus, did not run.\nThu, 10 Feb 2022 18:12:31 GMT LH:status Auditing: ARIA input fields have accessible names\nThu, 10 Feb 2022 18:12:31 GMT LH:Runner:warn Accessibility gatherer, required by audit aria-input-field-name, did not run.\nThu, 10 Feb 2022 18:12:31 GMT LH:status Auditing: ARIA `meter` elements have accessible names\nThu, 10 Feb 2022 18:12:31 GMT LH:Runner:warn Accessibility gatherer, required by audit aria-meter-name, did not run.\nThu, 10 Feb 2022 18:12:31 GMT LH:status Auditing: ARIA `progressbar` elements have accessible names\nThu, 10 Feb 2022 18:12:31 GMT LH:Runner:warn Accessibility gatherer, required by audit aria-progressbar-name, did not run.\nThu, 10 Feb 2022 18:12:31 GMT LH:status Auditing: `[role]`s have all required `[aria-*]` attributes\nThu, 10 Feb 2022 18:12:31 GMT LH:Runner:warn Accessibility gatherer, required by audit aria-required-attr, did not run.\nThu, 10 Feb 2022 18:12:31 GMT LH:status Auditing: Elements with an ARIA `[role]` that require children to contain a specific `[role]` have all required children.\nThu, 10 Feb 2022 18:12:31 GMT LH:Runner:warn Accessibility gatherer, required by audit aria-required-children, did not run.\nThu, 10 Feb 2022 18:12:31 GMT LH:status Auditing: `[role]`s are contained by their required parent element\nThu, 10 Feb 2022 18:12:31 GMT LH:Runner:warn Accessibility gatherer, required by audit aria-required-parent, did not run.\nThu, 10 Feb 2022 18:12:31 GMT LH:status Auditing: `[role]` values are valid\nThu, 10 Feb 2022 18:12:31 GMT LH:Runner:warn Accessibility gatherer, required by audit aria-roles, did not run.\nThu, 10 Feb 2022 18:12:31 GMT LH:status Auditing: ARIA toggle fields have accessible names\nThu, 10 Feb 2022 18:12:31 GMT LH:Runner:warn Accessibility gatherer, required by audit aria-toggle-field-name, did not run.\nThu, 10 Feb 2022 18:12:31 GMT LH:status Auditing: ARIA `tooltip` elements have accessible names\nThu, 10 Feb 2022 18:12:31 GMT LH:Runner:warn Accessibility gatherer, required by audit aria-tooltip-name, did not run.\nThu, 10 Feb 2022 18:12:31 GMT LH:status Auditing: ARIA `treeitem` elements have accessible names\nThu, 10 Feb 2022 18:12:31 GMT LH:Runner:warn Accessibility gatherer, required by audit aria-treeitem-name, did not run.\nThu, 10 Feb 2022 18:12:31 GMT LH:status Auditing: `[aria-*]` attributes have valid values\nThu, 10 Feb 2022 18:12:31 GMT LH:Runner:warn Accessibility gatherer, required by audit aria-valid-attr-value, did not run.\nThu, 10 Feb 2022 18:12:31 GMT LH:status Auditing: `[aria-*]` attributes are valid and not misspelled\nThu, 10 Feb 2022 18:12:31 GMT LH:Runner:warn Accessibility gatherer, required by audit aria-valid-attr, did not run.\nThu, 10 Feb 2022 18:12:31 GMT LH:status Auditing: Buttons have an accessible name\nThu, 10 Feb 2022 18:12:31 GMT LH:Runner:warn Accessibility gatherer, required by audit button-name, did not run.\nThu, 10 Feb 2022 18:12:31 GMT LH:status Auditing: The page contains a heading, skip link, or landmark region\nThu, 10 Feb 2022 18:12:31 GMT LH:Runner:warn Accessibility gatherer, required by audit bypass, did not run.\nThu, 10 Feb 2022 18:12:31 GMT LH:status Auditing: Background and foreground colors have a sufficient contrast ratio\nThu, 10 Feb 2022 18:12:31 GMT LH:Runner:warn Accessibility gatherer, required by audit color-contrast, did not run.\nThu, 10 Feb 2022 18:12:31 GMT LH:status Auditing: `<dl>`'s contain only properly-ordered `<dt>` and `<dd>` groups, `<script>`, `<template>` or `<div>` elements.\nThu, 10 Feb 2022 18:12:31 GMT LH:Runner:warn Accessibility gatherer, required by audit definition-list, did not run.\nThu, 10 Feb 2022 18:12:31 GMT LH:status Auditing: Definition list items are wrapped in `<dl>` elements\nThu, 10 Feb 2022 18:12:31 GMT LH:Runner:warn Accessibility gatherer, required by audit dlitem, did not run.\nThu, 10 Feb 2022 18:12:31 GMT LH:status Auditing: Document has a `<title>` element\nThu, 10 Feb 2022 18:12:31 GMT LH:Runner:warn Accessibility gatherer, required by audit document-title, did not run.\nThu, 10 Feb 2022 18:12:31 GMT LH:status Auditing: `[id]` attributes on active, focusable elements are unique\nThu, 10 Feb 2022 18:12:31 GMT LH:Runner:warn Accessibility gatherer, required by audit duplicate-id-active, did not run.\nThu, 10 Feb 2022 18:12:31 GMT LH:status Auditing: ARIA IDs are unique\nThu, 10 Feb 2022 18:12:31 GMT LH:Runner:warn Accessibility gatherer, required by audit duplicate-id-aria, did not run.\nThu, 10 Feb 2022 18:12:31 GMT LH:status Auditing: No form fields have multiple labels\nThu, 10 Feb 2022 18:12:31 GMT LH:Runner:warn Accessibility gatherer, required by audit form-field-multiple-labels, did not run.\nThu, 10 Feb 2022 18:12:31 GMT LH:status Auditing: `<frame>` or `<iframe>` elements have a title\nThu, 10 Feb 2022 18:12:31 GMT LH:Runner:warn Accessibility gatherer, required by audit frame-title, did not run.\nThu, 10 Feb 2022 18:12:31 GMT LH:status Auditing: Heading elements appear in a sequentially-descending order\nThu, 10 Feb 2022 18:12:31 GMT LH:Runner:warn Accessibility gatherer, required by audit heading-order, did not run.\nThu, 10 Feb 2022 18:12:31 GMT LH:status Auditing: `<html>` element has a `[lang]` attribute\nThu, 10 Feb 2022 18:12:31 GMT LH:Runner:warn Accessibility gatherer, required by audit html-has-lang, did not run.\nThu, 10 Feb 2022 18:12:31 GMT LH:status Auditing: `<html>` element has a valid value for its `[lang]` attribute\nThu, 10 Feb 2022 18:12:31 GMT LH:Runner:warn Accessibility gatherer, required by audit html-lang-valid, did not run.\nThu, 10 Feb 2022 18:12:31 GMT LH:status Auditing: Image elements have `[alt]` attributes\nThu, 10 Feb 2022 18:12:31 GMT LH:Runner:warn Accessibility gatherer, required by audit image-alt, did not run.\nThu, 10 Feb 2022 18:12:31 GMT LH:status Auditing: `<input type=\"image\">` elements have `[alt]` text\nThu, 10 Feb 2022 18:12:31 GMT LH:Runner:warn Accessibility gatherer, required by audit input-image-alt, did not run.\nThu, 10 Feb 2022 18:12:31 GMT LH:status Auditing: Form elements have associated labels\nThu, 10 Feb 2022 18:12:31 GMT LH:Runner:warn Accessibility gatherer, required by audit label, did not run.\nThu, 10 Feb 2022 18:12:31 GMT LH:status Auditing: Links have a discernible name\nThu, 10 Feb 2022 18:12:31 GMT LH:Runner:warn Accessibility gatherer, required by audit link-name, did not run.\nThu, 10 Feb 2022 18:12:31 GMT LH:status Auditing: Lists contain only `<li>` elements and script supporting elements (`<script>` and `<template>`).\nThu, 10 Feb 2022 18:12:31 GMT LH:Runner:warn Accessibility gatherer, required by audit list, did not run.\nThu, 10 Feb 2022 18:12:31 GMT LH:status Auditing: List items (`<li>`) are contained within `<ul>` or `<ol>` parent elements\nThu, 10 Feb 2022 18:12:31 GMT LH:Runner:warn Accessibility gatherer, required by audit listitem, did not run.\nThu, 10 Feb 2022 18:12:31 GMT LH:status Auditing: The document does not use `<meta http-equiv=\"refresh\">`\nThu, 10 Feb 2022 18:12:31 GMT LH:Runner:warn Accessibility gatherer, required by audit meta-refresh, did not run.\nThu, 10 Feb 2022 18:12:31 GMT LH:status Auditing: `[user-scalable=\"no\"]` is not used in the `<meta name=\"viewport\">` element and the `[maximum-scale]` attribute is not less than 5.\nThu, 10 Feb 2022 18:12:31 GMT LH:Runner:warn Accessibility gatherer, required by audit meta-viewport, did not run.\nThu, 10 Feb 2022 18:12:31 GMT LH:status Auditing: `<object>` elements have `[alt]` text\nThu, 10 Feb 2022 18:12:31 GMT LH:Runner:warn Accessibility gatherer, required by audit object-alt, did not run.\nThu, 10 Feb 2022 18:12:31 GMT LH:status Auditing: No element has a `[tabindex]` value greater than 0\nThu, 10 Feb 2022 18:12:31 GMT LH:Runner:warn Accessibility gatherer, required by audit tabindex, did not run.\nThu, 10 Feb 2022 18:12:31 GMT LH:status Auditing: Cells in a `<table>` element that use the `[headers]` attribute refer to table cells within the same table.\nThu, 10 Feb 2022 18:12:31 GMT LH:Runner:warn Accessibility gatherer, required by audit td-headers-attr, did not run.\nThu, 10 Feb 2022 18:12:31 GMT LH:status Auditing: `<th>` elements and elements with `[role=\"columnheader\"/\"rowheader\"]` have data cells they describe.\nThu, 10 Feb 2022 18:12:31 GMT LH:Runner:warn Accessibility gatherer, required by audit th-has-data-cells, did not run.\nThu, 10 Feb 2022 18:12:31 GMT LH:status Auditing: `[lang]` attributes have a valid value\nThu, 10 Feb 2022 18:12:31 GMT LH:Runner:warn Accessibility gatherer, required by audit valid-lang, did not run.\nThu, 10 Feb 2022 18:12:31 GMT LH:status Auditing: `<video>` elements contain a `<track>` element with `[kind=\"captions\"]`\nThu, 10 Feb 2022 18:12:31 GMT LH:Runner:warn Accessibility gatherer, required by audit video-caption, did not run.\nThu, 10 Feb 2022 18:12:31 GMT LH:status Auditing: Custom controls have associated labels\nThu, 10 Feb 2022 18:12:31 GMT LH:status Auditing: Custom controls have ARIA roles\nThu, 10 Feb 2022 18:12:31 GMT LH:status Auditing: User focus is not accidentally trapped in a region\nThu, 10 Feb 2022 18:12:31 GMT LH:status Auditing: Interactive controls are keyboard focusable\nThu, 10 Feb 2022 18:12:31 GMT LH:status Auditing: Interactive elements indicate their purpose and state\nThu, 10 Feb 2022 18:12:31 GMT LH:status Auditing: The page has a logical tab order\nThu, 10 Feb 2022 18:12:31 GMT LH:status Auditing: The user's focus is directed to new content added to the page\nThu, 10 Feb 2022 18:12:31 GMT LH:status Auditing: Offscreen content is hidden from assistive technology\nThu, 10 Feb 2022 18:12:31 GMT LH:status Auditing: HTML5 landmark elements are used to improve navigation\nThu, 10 Feb 2022 18:12:31 GMT LH:status Auditing: Visual order on the page follows DOM order\nThu, 10 Feb 2022 18:12:31 GMT LH:status Auditing: Uses efficient cache policy on static assets\nThu, 10 Feb 2022 18:12:31 GMT LH:Runner:warn devtoolsLogs gatherer, required by audit uses-long-cache-ttl, did not run.\nThu, 10 Feb 2022 18:12:31 GMT LH:status Auditing: Avoids enormous network payloads\nThu, 10 Feb 2022 18:12:31 GMT LH:Runner:warn devtoolsLogs gatherer, required by audit total-byte-weight, did not run.\nThu, 10 Feb 2022 18:12:31 GMT LH:status Auditing: Defer offscreen images\nThu, 10 Feb 2022 18:12:31 GMT LH:Runner:warn ImageElements gatherer, required by audit offscreen-images, did not run.\nThu, 10 Feb 2022 18:12:31 GMT LH:status Auditing: Eliminate render-blocking resources\nThu, 10 Feb 2022 18:12:31 GMT LH:Runner:warn TagsBlockingFirstPaint gatherer, required by audit render-blocking-resources, did not run.\nThu, 10 Feb 2022 18:12:31 GMT LH:status Auditing: Minify CSS\nThu, 10 Feb 2022 18:12:31 GMT LH:Runner:warn CSSUsage gatherer, required by audit unminified-css, did not run.\nThu, 10 Feb 2022 18:12:31 GMT LH:status Auditing: Minify JavaScript\nThu, 10 Feb 2022 18:12:31 GMT LH:Runner:warn ScriptElements gatherer, required by audit unminified-javascript, did not run.\nThu, 10 Feb 2022 18:12:31 GMT LH:status Auditing: Reduce unused CSS\nThu, 10 Feb 2022 18:12:31 GMT LH:Runner:warn CSSUsage gatherer, required by audit unused-css-rules, did not run.\nThu, 10 Feb 2022 18:12:31 GMT LH:status Auditing: Reduce unused JavaScript\nThu, 10 Feb 2022 18:12:31 GMT LH:Runner:warn JsUsage gatherer, required by audit unused-javascript, did not run.\nThu, 10 Feb 2022 18:12:31 GMT LH:status Auditing: Serve images in next-gen formats\nThu, 10 Feb 2022 18:12:31 GMT LH:Runner:warn OptimizedImages gatherer, required by audit modern-image-formats, did not run.\nThu, 10 Feb 2022 18:12:31 GMT LH:status Auditing: Efficiently encode images\nThu, 10 Feb 2022 18:12:31 GMT LH:Runner:warn OptimizedImages gatherer, required by audit uses-optimized-images, did not run.\nThu, 10 Feb 2022 18:12:31 GMT LH:status Auditing: Enable text compression\nThu, 10 Feb 2022 18:12:31 GMT LH:Runner:warn ResponseCompression gatherer, required by audit uses-text-compression, did not run.\nThu, 10 Feb 2022 18:12:31 GMT LH:status Auditing: Properly size images\nThu, 10 Feb 2022 18:12:31 GMT LH:Runner:warn ImageElements gatherer, required by audit uses-responsive-images, did not run.\nThu, 10 Feb 2022 18:12:31 GMT LH:status Auditing: Use video formats for animated content\nThu, 10 Feb 2022 18:12:31 GMT LH:Runner:warn devtoolsLogs gatherer, required by audit efficient-animated-content, did not run.\nThu, 10 Feb 2022 18:12:31 GMT LH:status Auditing: Remove duplicate modules in JavaScript bundles\nThu, 10 Feb 2022 18:12:31 GMT LH:Runner:warn devtoolsLogs gatherer, required by audit duplicated-javascript, did not run.\nThu, 10 Feb 2022 18:12:31 GMT LH:status Auditing: Avoid serving legacy JavaScript to modern browsers\nThu, 10 Feb 2022 18:12:31 GMT LH:Runner:warn devtoolsLogs gatherer, required by audit legacy-javascript, did not run.\nThu, 10 Feb 2022 18:12:31 GMT LH:status Auditing: Avoids Application Cache\nThu, 10 Feb 2022 18:12:31 GMT LH:Runner:warn AppCacheManifest gatherer, required by audit appcache-manifest, did not run.\nThu, 10 Feb 2022 18:12:31 GMT LH:status Auditing: Page has the HTML doctype\nThu, 10 Feb 2022 18:12:31 GMT LH:Runner:warn Doctype gatherer, required by audit doctype, did not run.\nThu, 10 Feb 2022 18:12:31 GMT LH:status Auditing: Properly defines charset\nThu, 10 Feb 2022 18:12:31 GMT LH:Runner:warn MainDocumentContent gatherer, required by audit charset, did not run.\nThu, 10 Feb 2022 18:12:31 GMT LH:status Auditing: Avoids an excessive DOM size\nThu, 10 Feb 2022 18:12:31 GMT LH:Runner:warn DOMStats gatherer, required by audit dom-size, did not run.\nThu, 10 Feb 2022 18:12:31 GMT LH:status Auditing: Links to cross-origin destinations are safe\nThu, 10 Feb 2022 18:12:31 GMT LH:Runner:warn AnchorElements gatherer, required by audit external-anchors-use-rel-noopener, did not run.\nThu, 10 Feb 2022 18:12:31 GMT LH:status Auditing: Avoids requesting the geolocation permission on page load\nThu, 10 Feb 2022 18:12:31 GMT LH:Runner:warn ConsoleMessages gatherer, required by audit geolocation-on-start, did not run.\nThu, 10 Feb 2022 18:12:31 GMT LH:status Auditing: No issues in the `Issues` panel in Chrome Devtools\nThu, 10 Feb 2022 18:12:31 GMT LH:Runner:warn InspectorIssues gatherer, required by audit inspector-issues, did not run.\nThu, 10 Feb 2022 18:12:31 GMT LH:status Auditing: Avoids `document.write()`\nThu, 10 Feb 2022 18:12:31 GMT LH:Runner:warn ConsoleMessages gatherer, required by audit no-document-write, did not run.\nThu, 10 Feb 2022 18:12:31 GMT LH:status Auditing: Avoids front-end JavaScript libraries with known security vulnerabilities\nThu, 10 Feb 2022 18:12:31 GMT LH:status Auditing: Detected JavaScript libraries\nThu, 10 Feb 2022 18:12:31 GMT LH:status Auditing: Avoids requesting the notification permission on page load\nThu, 10 Feb 2022 18:12:31 GMT LH:Runner:warn ConsoleMessages gatherer, required by audit notification-on-start, did not run.\nThu, 10 Feb 2022 18:12:31 GMT LH:status Auditing: Allows users to paste into password fields\nThu, 10 Feb 2022 18:12:31 GMT LH:Runner:warn PasswordInputsWithPreventedPaste gatherer, required by audit password-inputs-can-be-pasted-into, did not run.\nThu, 10 Feb 2022 18:12:31 GMT LH:status Auditing: Use HTTP/2\nThu, 10 Feb 2022 18:12:31 GMT LH:Runner:warn devtoolsLogs gatherer, required by audit uses-http2, did not run.\nThu, 10 Feb 2022 18:12:31 GMT LH:status Auditing: Uses passive listeners to improve scrolling performance\nThu, 10 Feb 2022 18:12:31 GMT LH:Runner:warn ConsoleMessages gatherer, required by audit uses-passive-event-listeners, did not run.\nThu, 10 Feb 2022 18:12:31 GMT LH:status Auditing: Document has a meta description\nThu, 10 Feb 2022 18:12:31 GMT LH:Runner:warn MetaElements gatherer, required by audit meta-description, did not run.\nThu, 10 Feb 2022 18:12:31 GMT LH:status Auditing: Page has successful HTTP status code\nThu, 10 Feb 2022 18:12:31 GMT LH:Runner:warn devtoolsLogs gatherer, required by audit http-status-code, did not run.\nThu, 10 Feb 2022 18:12:31 GMT LH:status Auditing: Document uses legible font sizes\nThu, 10 Feb 2022 18:12:31 GMT LH:Runner:warn FontSize gatherer, required by audit font-size, did not run.\nThu, 10 Feb 2022 18:12:31 GMT LH:status Auditing: Links have descriptive text\nThu, 10 Feb 2022 18:12:31 GMT LH:Runner:warn AnchorElements gatherer, required by audit link-text, did not run.\nThu, 10 Feb 2022 18:12:31 GMT LH:status Auditing: Links are crawlable\nThu, 10 Feb 2022 18:12:31 GMT LH:Runner:warn AnchorElements gatherer, required by audit crawlable-anchors, did not run.\nThu, 10 Feb 2022 18:12:31 GMT LH:status Auditing: Page isn’t blocked from indexing\nThu, 10 Feb 2022 18:12:31 GMT LH:Runner:warn MetaElements gatherer, required by audit is-crawlable, did not run.\nThu, 10 Feb 2022 18:12:31 GMT LH:status Auditing: robots.txt is valid\nThu, 10 Feb 2022 18:12:31 GMT LH:Runner:warn RobotsTxt gatherer, required by audit robots-txt, did not run.\nThu, 10 Feb 2022 18:12:31 GMT LH:status Auditing: Tap targets are sized appropriately\nThu, 10 Feb 2022 18:12:31 GMT LH:Runner:warn MetaElements gatherer, required by audit tap-targets, did not run.\nThu, 10 Feb 2022 18:12:31 GMT LH:status Auditing: Document has a valid `hreflang`\nThu, 10 Feb 2022 18:12:31 GMT LH:Runner:warn LinkElements gatherer, required by audit hreflang, did not run.\nThu, 10 Feb 2022 18:12:31 GMT LH:status Auditing: Document avoids plugins\nThu, 10 Feb 2022 18:12:31 GMT LH:Runner:warn EmbeddedContent gatherer, required by audit plugins, did not run.\nThu, 10 Feb 2022 18:12:31 GMT LH:status Auditing: Document has a valid `rel=canonical`\nThu, 10 Feb 2022 18:12:31 GMT LH:Runner:warn LinkElements gatherer, required by audit canonical, did not run.\nThu, 10 Feb 2022 18:12:31 GMT LH:status Auditing: Structured data is valid\nThu, 10 Feb 2022 18:12:31 GMT LH:status Generating results...\nThu, 10 Feb 2022 18:12:31 GMT LH:Printer json output written to /Users/bolajiayodeji/Tunnel/csc422_eval/report/fudutsinma_edu_ng_.report.json\nThu, 10 Feb 2022 18:12:31 GMT LH:Printer html output written to /Users/bolajiayodeji/Tunnel/csc422_eval/report/fudutsinma_edu_ng_.report.html\nThu, 10 Feb 2022 18:12:31 GMT LH:CLI Protip: Run lighthouse with `--view` to immediately open the HTML report in your browser\nThu, 10 Feb 2022 18:12:31 GMT LH:Printer csv output written to /Users/bolajiayodeji/Tunnel/csc422_eval/report/fudutsinma_edu_ng_.report.csv\nThu, 10 Feb 2022 18:12:31 GMT LH:ChromeLauncher Killing Chrome instance 8399\nRuntime error encountered: Lighthouse was unable to reliably load the page you requested. Make sure you are testing the correct URL and that the server is properly responding to all requests. (Details: net::ERR_CERT_COMMON_NAME_INVALID)\n"
  },
  {
    "url": "https://fud.edu.ng/",
    "name": "fud_edu_ng_",
    "file": "fud_edu_ng_.report.json",
    "html": "fud_edu_ng_.report.html",
    "csv": "fud_edu_ng_.report.csv",
    "score": 0.61,
    "detail": {
      "performance": 0.49,
      "accessibility": 0.79,
      "best-practices": 0.67,
      "seo": 0.66,
      "pwa": 0.42
    }
  },
  {
    "url": "https://fugusau.edu.ng/",
    "name": "fugusau_edu_ng_",
    "file": "fugusau_edu_ng_.report.json",
    "html": "fugusau_edu_ng_.report.html",
    "csv": "fugusau_edu_ng_.report.csv",
    "score": 0.68,
    "detail": {
      "performance": 0.4,
      "accessibility": 0.96,
      "best-practices": 0.8,
      "seo": 0.75,
      "pwa": 0.5
    }
  },
  {
    "url": "https://fukashere.edu.ng/",
    "name": "fukashere_edu_ng_",
    "file": "fukashere_edu_ng_.report.json",
    "html": "fukashere_edu_ng_.report.html",
    "csv": "fukashere_edu_ng_.report.csv",
    "score": 0.67,
    "detail": {
      "performance": 0.32,
      "accessibility": 0.94,
      "best-practices": 0.8,
      "seo": 0.79,
      "pwa": 0.5
    }
  },
  {
    "url": "https://fulafia.edu.ng/",
    "name": "fulafia_edu_ng_",
    "file": "fulafia_edu_ng_.report.json",
    "html": "fulafia_edu_ng_.report.html",
    "csv": "fulafia_edu_ng_.report.csv",
    "score": 0.58,
    "detail": {
      "performance": 0.36,
      "accessibility": 0.65,
      "best-practices": 0.67,
      "seo": 0.74,
      "pwa": 0.5
    }
  },
  {
    "url": "https://fulokoja.edu.ng/",
    "name": "fulokoja_edu_ng_",
    "file": "fulokoja_edu_ng_.report.json",
    "html": "fulokoja_edu_ng_.report.html",
    "csv": "fulokoja_edu_ng_.report.csv",
    "score": 0.67,
    "detail": {
      "performance": 0.49,
      "accessibility": 0.83,
      "best-practices": 0.8,
      "seo": 0.82,
      "pwa": 0.42
    }
  },
  {
    "url": "https://funai.edu.ng/",
    "name": "funai_edu_ng_",
    "file": "funai_edu_ng_.report.json",
    "html": "funai_edu_ng_.report.html",
    "csv": "funai_edu_ng_.report.csv",
    "score": 0.74,
    "detail": {
      "performance": 0.53,
      "accessibility": 0.98,
      "best-practices": 0.93,
      "seo": 0.75,
      "pwa": 0.5
    }
  },
  {
    "url": "https://fuotuoke.edu.ng/",
    "name": "fuotuoke_edu_ng_",
    "file": "fuotuoke_edu_ng_.report.json",
    "html": "fuotuoke_edu_ng_.report.html",
    "csv": "fuotuoke_edu_ng_.report.csv",
    "score": 0.61,
    "detail": {
      "performance": 0.37,
      "accessibility": 0.86,
      "best-practices": 0.73,
      "seo": 0.69,
      "pwa": 0.42
    }
  },
  {
    "url": "https://fuoye.edu.ng/",
    "name": "fuoye_edu_ng_",
    "file": "fuoye_edu_ng_.report.json",
    "html": "fuoye_edu_ng_.report.html",
    "csv": "fuoye_edu_ng_.report.csv",
    "score": 0.66,
    "detail": {
      "performance": 0.25,
      "accessibility": 0.96,
      "best-practices": 0.73,
      "seo": 0.86,
      "pwa": 0.5
    }
  },
  {
    "url": "https://fuwukari.edu.ng/",
    "name": "fuwukari_edu_ng_",
    "file": "fuwukari_edu_ng_.report.json",
    "html": "fuwukari_edu_ng_.report.html",
    "csv": "fuwukari_edu_ng_.report.csv",
    "score": 0.62,
    "detail": {
      "performance": 0.33,
      "accessibility": 0.89,
      "best-practices": 0.8,
      "seo": 0.92,
      "pwa": 0.17
    }
  },
  {
    "url": "https://mouau.edu.ng/",
    "name": "mouau_edu_ng_",
    "file": "mouau_edu_ng_.report.json",
    "html": "mouau_edu_ng_.report.html",
    "csv": "mouau_edu_ng_.report.csv",
    "score": 0.7,
    "detail": {
      "performance": 0.44,
      "accessibility": 0.9,
      "best-practices": 0.87,
      "seo": 0.77,
      "pwa": 0.5
    }
  },
  {
    "url": "https://nou.edu.ng/",
    "name": "nou_edu_ng_",
    "file": "nou_edu_ng_.report.json",
    "html": "nou_edu_ng_.report.html",
    "csv": "nou_edu_ng_.report.csv",
    "score": 0.79,
    "detail": {
      "performance": 0.9,
      "accessibility": 0.94,
      "best-practices": 0.87,
      "seo": 0.82,
      "pwa": 0.42
    }
  },
  {
    "url": "https://polac.edu.ng/",
    "name": "polac_edu_ng_",
    "file": "polac_edu_ng_.report.json",
    "html": "polac_edu_ng_.report.html",
    "csv": "polac_edu_ng_.report.csv",
    "score": 0,
    "error": "Thu, 10 Feb 2022 18:18:08 GMT LH:ChromeLauncher Waiting for browser.\nThu, 10 Feb 2022 18:18:08 GMT LH:ChromeLauncher Waiting for browser...\nThu, 10 Feb 2022 18:18:09 GMT LH:ChromeLauncher Waiting for browser.....\nThu, 10 Feb 2022 18:18:09 GMT LH:ChromeLauncher Waiting for browser.....\u001b[32m✓\u001b[0m\nThu, 10 Feb 2022 18:18:09 GMT LH:config:warn IFrameElements gatherer requested, however no audit requires it.\nThu, 10 Feb 2022 18:18:09 GMT LH:config:warn FormElements gatherer requested, however no audit requires it.\nThu, 10 Feb 2022 18:18:09 GMT LH:status Connecting to browser\nThu, 10 Feb 2022 18:18:09 GMT LH:status Resetting state with about:blank\nThu, 10 Feb 2022 18:18:09 GMT LH:status Navigating to about:blank\nThu, 10 Feb 2022 18:18:09 GMT LH:status Benchmarking machine\nThu, 10 Feb 2022 18:18:10 GMT LH:status Initializing…\nThu, 10 Feb 2022 18:18:10 GMT LH:status Preparing target for navigation mode\nThu, 10 Feb 2022 18:18:10 GMT LH:status Running defaultPass pass CSSUsage, JsUsage, ViewportDimensions, ConsoleMessages, AnchorElements, ImageElements, LinkElements, MetaElements, ScriptElements, IFrameElements, FormElements, MainDocumentContent, GlobalListeners, AppCacheManifest, Doctype, DOMStats, OptimizedImages, PasswordInputsWithPreventedPaste, ResponseCompression, TagsBlockingFirstPaint, FontSize, EmbeddedContent, RobotsTxt, TapTargets, Accessibility, TraceElements, InspectorIssues, SourceMaps, FullPageScreenshot\nThu, 10 Feb 2022 18:18:10 GMT LH:status Resetting state with about:blank\nThu, 10 Feb 2022 18:18:10 GMT LH:status Navigating to about:blank\nThu, 10 Feb 2022 18:18:10 GMT LH:status Preparing target for navigation\nThu, 10 Feb 2022 18:18:10 GMT LH:status Cleaning origin data\nThu, 10 Feb 2022 18:18:10 GMT LH:status Cleaning browser cache\nThu, 10 Feb 2022 18:18:10 GMT LH:status Preparing network conditions\nThu, 10 Feb 2022 18:18:10 GMT LH:status Beginning devtoolsLog and trace\nThu, 10 Feb 2022 18:18:10 GMT LH:status Loading page & waiting for onload\nThu, 10 Feb 2022 18:18:10 GMT LH:status Navigating to https://polac.edu.ng/\nThu, 10 Feb 2022 18:18:40 GMT LH:status Gathering in-page: CSSUsage\nThu, 10 Feb 2022 18:18:40 GMT LH:status Gathering in-page: JsUsage\nThu, 10 Feb 2022 18:18:40 GMT LH:status Gathering in-page: ViewportDimensions\nThu, 10 Feb 2022 18:18:40 GMT LH:status Gathering in-page: ConsoleMessages\nThu, 10 Feb 2022 18:18:40 GMT LH:status Gathering in-page: AnchorElements\nThu, 10 Feb 2022 18:18:40 GMT LH:status Gathering in-page: ImageElements\nThu, 10 Feb 2022 18:18:40 GMT LH:status Gathering in-page: LinkElements\nThu, 10 Feb 2022 18:18:40 GMT LH:status Gathering in-page: MetaElements\nThu, 10 Feb 2022 18:18:40 GMT LH:status Gathering in-page: ScriptElements\nThu, 10 Feb 2022 18:18:40 GMT LH:status Gathering in-page: IFrameElements\nThu, 10 Feb 2022 18:18:40 GMT LH:status Gathering in-page: FormElements\nThu, 10 Feb 2022 18:18:40 GMT LH:status Gathering in-page: MainDocumentContent\nThu, 10 Feb 2022 18:18:40 GMT LH:status Gathering in-page: GlobalListeners\nThu, 10 Feb 2022 18:18:40 GMT LH:status Gathering in-page: AppCacheManifest\nThu, 10 Feb 2022 18:18:40 GMT LH:status Gathering in-page: Doctype\nThu, 10 Feb 2022 18:18:40 GMT LH:status Gathering in-page: DOMStats\nThu, 10 Feb 2022 18:18:40 GMT LH:status Gathering in-page: OptimizedImages\nThu, 10 Feb 2022 18:18:40 GMT LH:status Gathering in-page: PasswordInputsWithPreventedPaste\nThu, 10 Feb 2022 18:18:40 GMT LH:status Gathering in-page: ResponseCompression\nThu, 10 Feb 2022 18:18:40 GMT LH:status Gathering in-page: TagsBlockingFirstPaint\nThu, 10 Feb 2022 18:18:40 GMT LH:status Gathering in-page: FontSize\nThu, 10 Feb 2022 18:18:40 GMT LH:status Gathering in-page: EmbeddedContent\nThu, 10 Feb 2022 18:18:40 GMT LH:status Gathering in-page: RobotsTxt\nThu, 10 Feb 2022 18:18:40 GMT LH:status Gathering in-page: TapTargets\nThu, 10 Feb 2022 18:18:40 GMT LH:status Gathering in-page: Accessibility\nThu, 10 Feb 2022 18:18:40 GMT LH:status Gathering in-page: TraceElements\nThu, 10 Feb 2022 18:18:40 GMT LH:status Gathering in-page: InspectorIssues\nThu, 10 Feb 2022 18:18:40 GMT LH:status Gathering in-page: SourceMaps\nThu, 10 Feb 2022 18:18:40 GMT LH:status Gathering in-page: FullPageScreenshot\nThu, 10 Feb 2022 18:18:40 GMT LH:status Gathering trace\nThu, 10 Feb 2022 18:18:40 GMT LH:status Gathering devtoolsLog & network records\nThu, 10 Feb 2022 18:18:40 GMT LH:GatherRunner:error DNS servers could not resolve the provided domain. https://polac.edu.ng/\nThu, 10 Feb 2022 18:18:40 GMT LH:status Disconnecting from browser...\nThu, 10 Feb 2022 18:18:40 GMT LH:status Cleaning origin data\nThu, 10 Feb 2022 18:18:40 GMT LH:status Analyzing and running audits...\nThu, 10 Feb 2022 18:18:40 GMT LH:status Auditing: Uses HTTPS\nThu, 10 Feb 2022 18:18:40 GMT LH:Runner:warn devtoolsLogs gatherer, required by audit is-on-https, did not run.\nThu, 10 Feb 2022 18:18:40 GMT LH:status Auditing: Redirects HTTP traffic to HTTPS\nThu, 10 Feb 2022 18:18:40 GMT LH:Runner:warn HTTPRedirect gatherer, required by audit redirects-http, did not run.\nThu, 10 Feb 2022 18:18:40 GMT LH:status Auditing: Registers a service worker that controls page and `start_url`\nThu, 10 Feb 2022 18:18:40 GMT LH:Runner:warn ServiceWorker gatherer, required by audit service-worker, did not run.\nThu, 10 Feb 2022 18:18:40 GMT LH:status Auditing: Has a `<meta name=\"viewport\">` tag with `width` or `initial-scale`\nThu, 10 Feb 2022 18:18:40 GMT LH:Runner:warn MetaElements gatherer, required by audit viewport, did not run.\nThu, 10 Feb 2022 18:18:40 GMT LH:status Auditing: First Contentful Paint\nThu, 10 Feb 2022 18:18:40 GMT LH:Runner:warn traces gatherer, required by audit first-contentful-paint, did not run.\nThu, 10 Feb 2022 18:18:40 GMT LH:status Auditing: Largest Contentful Paint\nThu, 10 Feb 2022 18:18:40 GMT LH:Runner:warn traces gatherer, required by audit largest-contentful-paint, did not run.\nThu, 10 Feb 2022 18:18:40 GMT LH:status Auditing: First Meaningful Paint\nThu, 10 Feb 2022 18:18:40 GMT LH:Runner:warn traces gatherer, required by audit first-meaningful-paint, did not run.\nThu, 10 Feb 2022 18:18:40 GMT LH:status Auditing: Speed Index\nThu, 10 Feb 2022 18:18:40 GMT LH:Runner:warn traces gatherer, required by audit speed-index, did not run.\nThu, 10 Feb 2022 18:18:40 GMT LH:status Auditing: Screenshot Thumbnails\nThu, 10 Feb 2022 18:18:40 GMT LH:Runner:warn traces gatherer, required by audit screenshot-thumbnails, did not run.\nThu, 10 Feb 2022 18:18:40 GMT LH:status Auditing: Final Screenshot\nThu, 10 Feb 2022 18:18:40 GMT LH:Runner:warn traces gatherer, required by audit final-screenshot, did not run.\nThu, 10 Feb 2022 18:18:40 GMT LH:status Auditing: Total Blocking Time\nThu, 10 Feb 2022 18:18:40 GMT LH:Runner:warn traces gatherer, required by audit total-blocking-time, did not run.\nThu, 10 Feb 2022 18:18:40 GMT LH:status Auditing: Max Potential First Input Delay\nThu, 10 Feb 2022 18:18:40 GMT LH:Runner:warn traces gatherer, required by audit max-potential-fid, did not run.\nThu, 10 Feb 2022 18:18:40 GMT LH:status Auditing: Cumulative Layout Shift\nThu, 10 Feb 2022 18:18:40 GMT LH:Runner:warn traces gatherer, required by audit cumulative-layout-shift, did not run.\nThu, 10 Feb 2022 18:18:40 GMT LH:status Auditing: No browser errors logged to the console\nThu, 10 Feb 2022 18:18:40 GMT LH:Runner:warn ConsoleMessages gatherer, required by audit errors-in-console, did not run.\nThu, 10 Feb 2022 18:18:40 GMT LH:status Auditing: Initial server response time was short\nThu, 10 Feb 2022 18:18:40 GMT LH:Runner:warn devtoolsLogs gatherer, required by audit server-response-time, did not run.\nThu, 10 Feb 2022 18:18:40 GMT LH:status Auditing: Time to Interactive\nThu, 10 Feb 2022 18:18:40 GMT LH:Runner:warn traces gatherer, required by audit interactive, did not run.\nThu, 10 Feb 2022 18:18:40 GMT LH:status Auditing: User Timing marks and measures\nThu, 10 Feb 2022 18:18:40 GMT LH:Runner:warn traces gatherer, required by audit user-timings, did not run.\nThu, 10 Feb 2022 18:18:40 GMT LH:status Auditing: Avoid chaining critical requests\nThu, 10 Feb 2022 18:18:40 GMT LH:Runner:warn traces gatherer, required by audit critical-request-chains, did not run.\nThu, 10 Feb 2022 18:18:40 GMT LH:status Auditing: Avoid multiple page redirects\nThu, 10 Feb 2022 18:18:40 GMT LH:Runner:warn devtoolsLogs gatherer, required by audit redirects, did not run.\nThu, 10 Feb 2022 18:18:40 GMT LH:status Auditing: Web app manifest and service worker meet the installability requirements\nThu, 10 Feb 2022 18:18:40 GMT LH:status Auditing: Provides a valid `apple-touch-icon`\nThu, 10 Feb 2022 18:18:40 GMT LH:Runner:warn LinkElements gatherer, required by audit apple-touch-icon, did not run.\nThu, 10 Feb 2022 18:18:40 GMT LH:status Auditing: Configured for a custom splash screen\nThu, 10 Feb 2022 18:18:40 GMT LH:status Auditing: Sets a theme color for the address bar.\nThu, 10 Feb 2022 18:18:40 GMT LH:Runner:warn MetaElements gatherer, required by audit themed-omnibox, did not run.\nThu, 10 Feb 2022 18:18:40 GMT LH:status Auditing: Manifest has a maskable icon\nThu, 10 Feb 2022 18:18:40 GMT LH:status Auditing: Content is sized correctly for the viewport\nThu, 10 Feb 2022 18:18:40 GMT LH:Runner:warn ViewportDimensions gatherer, required by audit content-width, did not run.\nThu, 10 Feb 2022 18:18:40 GMT LH:status Auditing: Displays images with correct aspect ratio\nThu, 10 Feb 2022 18:18:40 GMT LH:Runner:warn ImageElements gatherer, required by audit image-aspect-ratio, did not run.\nThu, 10 Feb 2022 18:18:40 GMT LH:status Auditing: Serves images with appropriate resolution\nThu, 10 Feb 2022 18:18:40 GMT LH:Runner:warn ImageElements gatherer, required by audit image-size-responsive, did not run.\nThu, 10 Feb 2022 18:18:40 GMT LH:status Auditing: Fonts with `font-display: optional` are preloaded\nThu, 10 Feb 2022 18:18:40 GMT LH:Runner:warn devtoolsLogs gatherer, required by audit preload-fonts, did not run.\nThu, 10 Feb 2022 18:18:40 GMT LH:status Auditing: Avoids deprecated APIs\nThu, 10 Feb 2022 18:18:40 GMT LH:Runner:warn ConsoleMessages gatherer, required by audit deprecations, did not run.\nThu, 10 Feb 2022 18:18:40 GMT LH:status Auditing: Minimizes main-thread work\nThu, 10 Feb 2022 18:18:40 GMT LH:Runner:warn traces gatherer, required by audit mainthread-work-breakdown, did not run.\nThu, 10 Feb 2022 18:18:40 GMT LH:status Auditing: JavaScript execution time\nThu, 10 Feb 2022 18:18:40 GMT LH:Runner:warn traces gatherer, required by audit bootup-time, did not run.\nThu, 10 Feb 2022 18:18:40 GMT LH:status Auditing: Preload key requests\nThu, 10 Feb 2022 18:18:40 GMT LH:Runner:warn devtoolsLogs gatherer, required by audit uses-rel-preload, did not run.\nThu, 10 Feb 2022 18:18:40 GMT LH:status Auditing: Preconnect to required origins\nThu, 10 Feb 2022 18:18:40 GMT LH:Runner:warn traces gatherer, required by audit uses-rel-preconnect, did not run.\nThu, 10 Feb 2022 18:18:40 GMT LH:status Auditing: All text remains visible during webfont loads\nThu, 10 Feb 2022 18:18:40 GMT LH:Runner:warn devtoolsLogs gatherer, required by audit font-display, did not run.\nThu, 10 Feb 2022 18:18:40 GMT LH:status Auditing: Diagnostics\nThu, 10 Feb 2022 18:18:40 GMT LH:Runner:warn traces gatherer, required by audit diagnostics, did not run.\nThu, 10 Feb 2022 18:18:40 GMT LH:status Auditing: Network Requests\nThu, 10 Feb 2022 18:18:40 GMT LH:Runner:warn devtoolsLogs gatherer, required by audit network-requests, did not run.\nThu, 10 Feb 2022 18:18:40 GMT LH:status Auditing: Network Round Trip Times\nThu, 10 Feb 2022 18:18:40 GMT LH:Runner:warn devtoolsLogs gatherer, required by audit network-rtt, did not run.\nThu, 10 Feb 2022 18:18:40 GMT LH:status Auditing: Server Backend Latencies\nThu, 10 Feb 2022 18:18:40 GMT LH:Runner:warn devtoolsLogs gatherer, required by audit network-server-latency, did not run.\nThu, 10 Feb 2022 18:18:40 GMT LH:status Auditing: Tasks\nThu, 10 Feb 2022 18:18:40 GMT LH:Runner:warn traces gatherer, required by audit main-thread-tasks, did not run.\nThu, 10 Feb 2022 18:18:40 GMT LH:status Auditing: Metrics\nThu, 10 Feb 2022 18:18:40 GMT LH:Runner:warn traces gatherer, required by audit metrics, did not run.\nThu, 10 Feb 2022 18:18:40 GMT LH:status Auditing: Performance budget\nThu, 10 Feb 2022 18:18:40 GMT LH:Runner:warn devtoolsLogs gatherer, required by audit performance-budget, did not run.\nThu, 10 Feb 2022 18:18:40 GMT LH:status Auditing: Timing budget\nThu, 10 Feb 2022 18:18:40 GMT LH:Runner:warn devtoolsLogs gatherer, required by audit timing-budget, did not run.\nThu, 10 Feb 2022 18:18:40 GMT LH:status Auditing: Keep request counts low and transfer sizes small\nThu, 10 Feb 2022 18:18:40 GMT LH:Runner:warn devtoolsLogs gatherer, required by audit resource-summary, did not run.\nThu, 10 Feb 2022 18:18:40 GMT LH:status Auditing: Minimize third-party usage\nThu, 10 Feb 2022 18:18:40 GMT LH:Runner:warn traces gatherer, required by audit third-party-summary, did not run.\nThu, 10 Feb 2022 18:18:40 GMT LH:status Auditing: Lazy load third-party resources with facades\nThu, 10 Feb 2022 18:18:40 GMT LH:Runner:warn traces gatherer, required by audit third-party-facades, did not run.\nThu, 10 Feb 2022 18:18:40 GMT LH:status Auditing: Largest Contentful Paint element\nThu, 10 Feb 2022 18:18:40 GMT LH:Runner:warn traces gatherer, required by audit largest-contentful-paint-element, did not run.\nThu, 10 Feb 2022 18:18:40 GMT LH:status Auditing: Largest Contentful Paint image was not lazily loaded\nThu, 10 Feb 2022 18:18:40 GMT LH:Runner:warn TraceElements gatherer, required by audit lcp-lazy-loaded, did not run.\nThu, 10 Feb 2022 18:18:40 GMT LH:status Auditing: Avoid large layout shifts\nThu, 10 Feb 2022 18:18:40 GMT LH:Runner:warn traces gatherer, required by audit layout-shift-elements, did not run.\nThu, 10 Feb 2022 18:18:40 GMT LH:status Auditing: Avoid long main-thread tasks\nThu, 10 Feb 2022 18:18:40 GMT LH:Runner:warn traces gatherer, required by audit long-tasks, did not run.\nThu, 10 Feb 2022 18:18:40 GMT LH:status Auditing: Avoids `unload` event listeners\nThu, 10 Feb 2022 18:18:40 GMT LH:Runner:warn GlobalListeners gatherer, required by audit no-unload-listeners, did not run.\nThu, 10 Feb 2022 18:18:40 GMT LH:status Auditing: Avoid non-composited animations\nThu, 10 Feb 2022 18:18:40 GMT LH:Runner:warn TraceElements gatherer, required by audit non-composited-animations, did not run.\nThu, 10 Feb 2022 18:18:40 GMT LH:status Auditing: Image elements have explicit `width` and `height`\nThu, 10 Feb 2022 18:18:40 GMT LH:Runner:warn ImageElements gatherer, required by audit unsized-images, did not run.\nThu, 10 Feb 2022 18:18:40 GMT LH:status Auditing: Page has valid source maps\nThu, 10 Feb 2022 18:18:40 GMT LH:Runner:warn ScriptElements gatherer, required by audit valid-source-maps, did not run.\nThu, 10 Feb 2022 18:18:40 GMT LH:status Auditing: Preload Largest Contentful Paint image\nThu, 10 Feb 2022 18:18:40 GMT LH:Runner:warn traces gatherer, required by audit preload-lcp-image, did not run.\nThu, 10 Feb 2022 18:18:40 GMT LH:status Auditing: Ensure CSP is effective against XSS attacks\nThu, 10 Feb 2022 18:18:40 GMT LH:Runner:warn devtoolsLogs gatherer, required by audit csp-xss, did not run.\nThu, 10 Feb 2022 18:18:40 GMT LH:status Auditing: Full-page screenshot\nThu, 10 Feb 2022 18:18:40 GMT LH:Runner:warn FullPageScreenshot gatherer, required by audit full-page-screenshot, did not run.\nThu, 10 Feb 2022 18:18:40 GMT LH:status Auditing: Script Treemap Data\nThu, 10 Feb 2022 18:18:40 GMT LH:Runner:warn traces gatherer, required by audit script-treemap-data, did not run.\nThu, 10 Feb 2022 18:18:40 GMT LH:status Auditing: Site works cross-browser\nThu, 10 Feb 2022 18:18:40 GMT LH:status Auditing: Page transitions don't feel like they block on the network\nThu, 10 Feb 2022 18:18:40 GMT LH:status Auditing: Each page has a URL\nThu, 10 Feb 2022 18:18:40 GMT LH:status Auditing: `[accesskey]` values are unique\nThu, 10 Feb 2022 18:18:40 GMT LH:Runner:warn Accessibility gatherer, required by audit accesskeys, did not run.\nThu, 10 Feb 2022 18:18:40 GMT LH:status Auditing: `[aria-*]` attributes match their roles\nThu, 10 Feb 2022 18:18:40 GMT LH:Runner:warn Accessibility gatherer, required by audit aria-allowed-attr, did not run.\nThu, 10 Feb 2022 18:18:40 GMT LH:status Auditing: `button`, `link`, and `menuitem` elements have accessible names\nThu, 10 Feb 2022 18:18:40 GMT LH:Runner:warn Accessibility gatherer, required by audit aria-command-name, did not run.\nThu, 10 Feb 2022 18:18:40 GMT LH:status Auditing: `[aria-hidden=\"true\"]` is not present on the document `<body>`\nThu, 10 Feb 2022 18:18:40 GMT LH:Runner:warn Accessibility gatherer, required by audit aria-hidden-body, did not run.\nThu, 10 Feb 2022 18:18:40 GMT LH:status Auditing: `[aria-hidden=\"true\"]` elements do not contain focusable descendents\nThu, 10 Feb 2022 18:18:40 GMT LH:Runner:warn Accessibility gatherer, required by audit aria-hidden-focus, did not run.\nThu, 10 Feb 2022 18:18:40 GMT LH:status Auditing: ARIA input fields have accessible names\nThu, 10 Feb 2022 18:18:40 GMT LH:Runner:warn Accessibility gatherer, required by audit aria-input-field-name, did not run.\nThu, 10 Feb 2022 18:18:40 GMT LH:status Auditing: ARIA `meter` elements have accessible names\nThu, 10 Feb 2022 18:18:40 GMT LH:Runner:warn Accessibility gatherer, required by audit aria-meter-name, did not run.\nThu, 10 Feb 2022 18:18:40 GMT LH:status Auditing: ARIA `progressbar` elements have accessible names\nThu, 10 Feb 2022 18:18:40 GMT LH:Runner:warn Accessibility gatherer, required by audit aria-progressbar-name, did not run.\nThu, 10 Feb 2022 18:18:40 GMT LH:status Auditing: `[role]`s have all required `[aria-*]` attributes\nThu, 10 Feb 2022 18:18:40 GMT LH:Runner:warn Accessibility gatherer, required by audit aria-required-attr, did not run.\nThu, 10 Feb 2022 18:18:40 GMT LH:status Auditing: Elements with an ARIA `[role]` that require children to contain a specific `[role]` have all required children.\nThu, 10 Feb 2022 18:18:40 GMT LH:Runner:warn Accessibility gatherer, required by audit aria-required-children, did not run.\nThu, 10 Feb 2022 18:18:40 GMT LH:status Auditing: `[role]`s are contained by their required parent element\nThu, 10 Feb 2022 18:18:40 GMT LH:Runner:warn Accessibility gatherer, required by audit aria-required-parent, did not run.\nThu, 10 Feb 2022 18:18:40 GMT LH:status Auditing: `[role]` values are valid\nThu, 10 Feb 2022 18:18:40 GMT LH:Runner:warn Accessibility gatherer, required by audit aria-roles, did not run.\nThu, 10 Feb 2022 18:18:40 GMT LH:status Auditing: ARIA toggle fields have accessible names\nThu, 10 Feb 2022 18:18:40 GMT LH:Runner:warn Accessibility gatherer, required by audit aria-toggle-field-name, did not run.\nThu, 10 Feb 2022 18:18:40 GMT LH:status Auditing: ARIA `tooltip` elements have accessible names\nThu, 10 Feb 2022 18:18:40 GMT LH:Runner:warn Accessibility gatherer, required by audit aria-tooltip-name, did not run.\nThu, 10 Feb 2022 18:18:40 GMT LH:status Auditing: ARIA `treeitem` elements have accessible names\nThu, 10 Feb 2022 18:18:40 GMT LH:Runner:warn Accessibility gatherer, required by audit aria-treeitem-name, did not run.\nThu, 10 Feb 2022 18:18:40 GMT LH:status Auditing: `[aria-*]` attributes have valid values\nThu, 10 Feb 2022 18:18:40 GMT LH:Runner:warn Accessibility gatherer, required by audit aria-valid-attr-value, did not run.\nThu, 10 Feb 2022 18:18:40 GMT LH:status Auditing: `[aria-*]` attributes are valid and not misspelled\nThu, 10 Feb 2022 18:18:40 GMT LH:Runner:warn Accessibility gatherer, required by audit aria-valid-attr, did not run.\nThu, 10 Feb 2022 18:18:40 GMT LH:status Auditing: Buttons have an accessible name\nThu, 10 Feb 2022 18:18:40 GMT LH:Runner:warn Accessibility gatherer, required by audit button-name, did not run.\nThu, 10 Feb 2022 18:18:40 GMT LH:status Auditing: The page contains a heading, skip link, or landmark region\nThu, 10 Feb 2022 18:18:40 GMT LH:Runner:warn Accessibility gatherer, required by audit bypass, did not run.\nThu, 10 Feb 2022 18:18:40 GMT LH:status Auditing: Background and foreground colors have a sufficient contrast ratio\nThu, 10 Feb 2022 18:18:40 GMT LH:Runner:warn Accessibility gatherer, required by audit color-contrast, did not run.\nThu, 10 Feb 2022 18:18:40 GMT LH:status Auditing: `<dl>`'s contain only properly-ordered `<dt>` and `<dd>` groups, `<script>`, `<template>` or `<div>` elements.\nThu, 10 Feb 2022 18:18:40 GMT LH:Runner:warn Accessibility gatherer, required by audit definition-list, did not run.\nThu, 10 Feb 2022 18:18:40 GMT LH:status Auditing: Definition list items are wrapped in `<dl>` elements\nThu, 10 Feb 2022 18:18:40 GMT LH:Runner:warn Accessibility gatherer, required by audit dlitem, did not run.\nThu, 10 Feb 2022 18:18:40 GMT LH:status Auditing: Document has a `<title>` element\nThu, 10 Feb 2022 18:18:40 GMT LH:Runner:warn Accessibility gatherer, required by audit document-title, did not run.\nThu, 10 Feb 2022 18:18:40 GMT LH:status Auditing: `[id]` attributes on active, focusable elements are unique\nThu, 10 Feb 2022 18:18:40 GMT LH:Runner:warn Accessibility gatherer, required by audit duplicate-id-active, did not run.\nThu, 10 Feb 2022 18:18:40 GMT LH:status Auditing: ARIA IDs are unique\nThu, 10 Feb 2022 18:18:40 GMT LH:Runner:warn Accessibility gatherer, required by audit duplicate-id-aria, did not run.\nThu, 10 Feb 2022 18:18:40 GMT LH:status Auditing: No form fields have multiple labels\nThu, 10 Feb 2022 18:18:40 GMT LH:Runner:warn Accessibility gatherer, required by audit form-field-multiple-labels, did not run.\nThu, 10 Feb 2022 18:18:40 GMT LH:status Auditing: `<frame>` or `<iframe>` elements have a title\nThu, 10 Feb 2022 18:18:40 GMT LH:Runner:warn Accessibility gatherer, required by audit frame-title, did not run.\nThu, 10 Feb 2022 18:18:40 GMT LH:status Auditing: Heading elements appear in a sequentially-descending order\nThu, 10 Feb 2022 18:18:40 GMT LH:Runner:warn Accessibility gatherer, required by audit heading-order, did not run.\nThu, 10 Feb 2022 18:18:40 GMT LH:status Auditing: `<html>` element has a `[lang]` attribute\nThu, 10 Feb 2022 18:18:40 GMT LH:Runner:warn Accessibility gatherer, required by audit html-has-lang, did not run.\nThu, 10 Feb 2022 18:18:40 GMT LH:status Auditing: `<html>` element has a valid value for its `[lang]` attribute\nThu, 10 Feb 2022 18:18:40 GMT LH:Runner:warn Accessibility gatherer, required by audit html-lang-valid, did not run.\nThu, 10 Feb 2022 18:18:40 GMT LH:status Auditing: Image elements have `[alt]` attributes\nThu, 10 Feb 2022 18:18:40 GMT LH:Runner:warn Accessibility gatherer, required by audit image-alt, did not run.\nThu, 10 Feb 2022 18:18:40 GMT LH:status Auditing: `<input type=\"image\">` elements have `[alt]` text\nThu, 10 Feb 2022 18:18:40 GMT LH:Runner:warn Accessibility gatherer, required by audit input-image-alt, did not run.\nThu, 10 Feb 2022 18:18:40 GMT LH:status Auditing: Form elements have associated labels\nThu, 10 Feb 2022 18:18:40 GMT LH:Runner:warn Accessibility gatherer, required by audit label, did not run.\nThu, 10 Feb 2022 18:18:40 GMT LH:status Auditing: Links have a discernible name\nThu, 10 Feb 2022 18:18:40 GMT LH:Runner:warn Accessibility gatherer, required by audit link-name, did not run.\nThu, 10 Feb 2022 18:18:40 GMT LH:status Auditing: Lists contain only `<li>` elements and script supporting elements (`<script>` and `<template>`).\nThu, 10 Feb 2022 18:18:40 GMT LH:Runner:warn Accessibility gatherer, required by audit list, did not run.\nThu, 10 Feb 2022 18:18:40 GMT LH:status Auditing: List items (`<li>`) are contained within `<ul>` or `<ol>` parent elements\nThu, 10 Feb 2022 18:18:40 GMT LH:Runner:warn Accessibility gatherer, required by audit listitem, did not run.\nThu, 10 Feb 2022 18:18:40 GMT LH:status Auditing: The document does not use `<meta http-equiv=\"refresh\">`\nThu, 10 Feb 2022 18:18:40 GMT LH:Runner:warn Accessibility gatherer, required by audit meta-refresh, did not run.\nThu, 10 Feb 2022 18:18:40 GMT LH:status Auditing: `[user-scalable=\"no\"]` is not used in the `<meta name=\"viewport\">` element and the `[maximum-scale]` attribute is not less than 5.\nThu, 10 Feb 2022 18:18:40 GMT LH:Runner:warn Accessibility gatherer, required by audit meta-viewport, did not run.\nThu, 10 Feb 2022 18:18:40 GMT LH:status Auditing: `<object>` elements have `[alt]` text\nThu, 10 Feb 2022 18:18:40 GMT LH:Runner:warn Accessibility gatherer, required by audit object-alt, did not run.\nThu, 10 Feb 2022 18:18:40 GMT LH:status Auditing: No element has a `[tabindex]` value greater than 0\nThu, 10 Feb 2022 18:18:40 GMT LH:Runner:warn Accessibility gatherer, required by audit tabindex, did not run.\nThu, 10 Feb 2022 18:18:40 GMT LH:status Auditing: Cells in a `<table>` element that use the `[headers]` attribute refer to table cells within the same table.\nThu, 10 Feb 2022 18:18:40 GMT LH:Runner:warn Accessibility gatherer, required by audit td-headers-attr, did not run.\nThu, 10 Feb 2022 18:18:40 GMT LH:status Auditing: `<th>` elements and elements with `[role=\"columnheader\"/\"rowheader\"]` have data cells they describe.\nThu, 10 Feb 2022 18:18:40 GMT LH:Runner:warn Accessibility gatherer, required by audit th-has-data-cells, did not run.\nThu, 10 Feb 2022 18:18:40 GMT LH:status Auditing: `[lang]` attributes have a valid value\nThu, 10 Feb 2022 18:18:40 GMT LH:Runner:warn Accessibility gatherer, required by audit valid-lang, did not run.\nThu, 10 Feb 2022 18:18:40 GMT LH:status Auditing: `<video>` elements contain a `<track>` element with `[kind=\"captions\"]`\nThu, 10 Feb 2022 18:18:40 GMT LH:Runner:warn Accessibility gatherer, required by audit video-caption, did not run.\nThu, 10 Feb 2022 18:18:40 GMT LH:status Auditing: Custom controls have associated labels\nThu, 10 Feb 2022 18:18:40 GMT LH:status Auditing: Custom controls have ARIA roles\nThu, 10 Feb 2022 18:18:40 GMT LH:status Auditing: User focus is not accidentally trapped in a region\nThu, 10 Feb 2022 18:18:40 GMT LH:status Auditing: Interactive controls are keyboard focusable\nThu, 10 Feb 2022 18:18:40 GMT LH:status Auditing: Interactive elements indicate their purpose and state\nThu, 10 Feb 2022 18:18:40 GMT LH:status Auditing: The page has a logical tab order\nThu, 10 Feb 2022 18:18:40 GMT LH:status Auditing: The user's focus is directed to new content added to the page\nThu, 10 Feb 2022 18:18:40 GMT LH:status Auditing: Offscreen content is hidden from assistive technology\nThu, 10 Feb 2022 18:18:40 GMT LH:status Auditing: HTML5 landmark elements are used to improve navigation\nThu, 10 Feb 2022 18:18:40 GMT LH:status Auditing: Visual order on the page follows DOM order\nThu, 10 Feb 2022 18:18:40 GMT LH:status Auditing: Uses efficient cache policy on static assets\nThu, 10 Feb 2022 18:18:40 GMT LH:Runner:warn devtoolsLogs gatherer, required by audit uses-long-cache-ttl, did not run.\nThu, 10 Feb 2022 18:18:40 GMT LH:status Auditing: Avoids enormous network payloads\nThu, 10 Feb 2022 18:18:40 GMT LH:Runner:warn devtoolsLogs gatherer, required by audit total-byte-weight, did not run.\nThu, 10 Feb 2022 18:18:40 GMT LH:status Auditing: Defer offscreen images\nThu, 10 Feb 2022 18:18:40 GMT LH:Runner:warn ImageElements gatherer, required by audit offscreen-images, did not run.\nThu, 10 Feb 2022 18:18:40 GMT LH:status Auditing: Eliminate render-blocking resources\nThu, 10 Feb 2022 18:18:40 GMT LH:Runner:warn TagsBlockingFirstPaint gatherer, required by audit render-blocking-resources, did not run.\nThu, 10 Feb 2022 18:18:40 GMT LH:status Auditing: Minify CSS\nThu, 10 Feb 2022 18:18:40 GMT LH:Runner:warn CSSUsage gatherer, required by audit unminified-css, did not run.\nThu, 10 Feb 2022 18:18:40 GMT LH:status Auditing: Minify JavaScript\nThu, 10 Feb 2022 18:18:40 GMT LH:Runner:warn ScriptElements gatherer, required by audit unminified-javascript, did not run.\nThu, 10 Feb 2022 18:18:40 GMT LH:status Auditing: Reduce unused CSS\nThu, 10 Feb 2022 18:18:40 GMT LH:Runner:warn CSSUsage gatherer, required by audit unused-css-rules, did not run.\nThu, 10 Feb 2022 18:18:40 GMT LH:status Auditing: Reduce unused JavaScript\nThu, 10 Feb 2022 18:18:40 GMT LH:Runner:warn JsUsage gatherer, required by audit unused-javascript, did not run.\nThu, 10 Feb 2022 18:18:40 GMT LH:status Auditing: Serve images in next-gen formats\nThu, 10 Feb 2022 18:18:40 GMT LH:Runner:warn OptimizedImages gatherer, required by audit modern-image-formats, did not run.\nThu, 10 Feb 2022 18:18:40 GMT LH:status Auditing: Efficiently encode images\nThu, 10 Feb 2022 18:18:40 GMT LH:Runner:warn OptimizedImages gatherer, required by audit uses-optimized-images, did not run.\nThu, 10 Feb 2022 18:18:40 GMT LH:status Auditing: Enable text compression\nThu, 10 Feb 2022 18:18:40 GMT LH:Runner:warn ResponseCompression gatherer, required by audit uses-text-compression, did not run.\nThu, 10 Feb 2022 18:18:40 GMT LH:status Auditing: Properly size images\nThu, 10 Feb 2022 18:18:40 GMT LH:Runner:warn ImageElements gatherer, required by audit uses-responsive-images, did not run.\nThu, 10 Feb 2022 18:18:40 GMT LH:status Auditing: Use video formats for animated content\nThu, 10 Feb 2022 18:18:40 GMT LH:Runner:warn devtoolsLogs gatherer, required by audit efficient-animated-content, did not run.\nThu, 10 Feb 2022 18:18:40 GMT LH:status Auditing: Remove duplicate modules in JavaScript bundles\nThu, 10 Feb 2022 18:18:40 GMT LH:Runner:warn devtoolsLogs gatherer, required by audit duplicated-javascript, did not run.\nThu, 10 Feb 2022 18:18:40 GMT LH:status Auditing: Avoid serving legacy JavaScript to modern browsers\nThu, 10 Feb 2022 18:18:40 GMT LH:Runner:warn devtoolsLogs gatherer, required by audit legacy-javascript, did not run.\nThu, 10 Feb 2022 18:18:40 GMT LH:status Auditing: Avoids Application Cache\nThu, 10 Feb 2022 18:18:40 GMT LH:Runner:warn AppCacheManifest gatherer, required by audit appcache-manifest, did not run.\nThu, 10 Feb 2022 18:18:40 GMT LH:status Auditing: Page has the HTML doctype\nThu, 10 Feb 2022 18:18:40 GMT LH:Runner:warn Doctype gatherer, required by audit doctype, did not run.\nThu, 10 Feb 2022 18:18:40 GMT LH:status Auditing: Properly defines charset\nThu, 10 Feb 2022 18:18:40 GMT LH:Runner:warn MainDocumentContent gatherer, required by audit charset, did not run.\nThu, 10 Feb 2022 18:18:40 GMT LH:status Auditing: Avoids an excessive DOM size\nThu, 10 Feb 2022 18:18:40 GMT LH:Runner:warn DOMStats gatherer, required by audit dom-size, did not run.\nThu, 10 Feb 2022 18:18:40 GMT LH:status Auditing: Links to cross-origin destinations are safe\nThu, 10 Feb 2022 18:18:40 GMT LH:Runner:warn AnchorElements gatherer, required by audit external-anchors-use-rel-noopener, did not run.\nThu, 10 Feb 2022 18:18:40 GMT LH:status Auditing: Avoids requesting the geolocation permission on page load\nThu, 10 Feb 2022 18:18:40 GMT LH:Runner:warn ConsoleMessages gatherer, required by audit geolocation-on-start, did not run.\nThu, 10 Feb 2022 18:18:40 GMT LH:status Auditing: No issues in the `Issues` panel in Chrome Devtools\nThu, 10 Feb 2022 18:18:40 GMT LH:Runner:warn InspectorIssues gatherer, required by audit inspector-issues, did not run.\nThu, 10 Feb 2022 18:18:40 GMT LH:status Auditing: Avoids `document.write()`\nThu, 10 Feb 2022 18:18:40 GMT LH:Runner:warn ConsoleMessages gatherer, required by audit no-document-write, did not run.\nThu, 10 Feb 2022 18:18:40 GMT LH:status Auditing: Avoids front-end JavaScript libraries with known security vulnerabilities\nThu, 10 Feb 2022 18:18:40 GMT LH:status Auditing: Detected JavaScript libraries\nThu, 10 Feb 2022 18:18:40 GMT LH:status Auditing: Avoids requesting the notification permission on page load\nThu, 10 Feb 2022 18:18:40 GMT LH:Runner:warn ConsoleMessages gatherer, required by audit notification-on-start, did not run.\nThu, 10 Feb 2022 18:18:40 GMT LH:status Auditing: Allows users to paste into password fields\nThu, 10 Feb 2022 18:18:40 GMT LH:Runner:warn PasswordInputsWithPreventedPaste gatherer, required by audit password-inputs-can-be-pasted-into, did not run.\nThu, 10 Feb 2022 18:18:40 GMT LH:status Auditing: Use HTTP/2\nThu, 10 Feb 2022 18:18:40 GMT LH:Runner:warn devtoolsLogs gatherer, required by audit uses-http2, did not run.\nThu, 10 Feb 2022 18:18:40 GMT LH:status Auditing: Uses passive listeners to improve scrolling performance\nThu, 10 Feb 2022 18:18:40 GMT LH:Runner:warn ConsoleMessages gatherer, required by audit uses-passive-event-listeners, did not run.\nThu, 10 Feb 2022 18:18:40 GMT LH:status Auditing: Document has a meta description\nThu, 10 Feb 2022 18:18:40 GMT LH:Runner:warn MetaElements gatherer, required by audit meta-description, did not run.\nThu, 10 Feb 2022 18:18:40 GMT LH:status Auditing: Page has successful HTTP status code\nThu, 10 Feb 2022 18:18:40 GMT LH:Runner:warn devtoolsLogs gatherer, required by audit http-status-code, did not run.\nThu, 10 Feb 2022 18:18:40 GMT LH:status Auditing: Document uses legible font sizes\nThu, 10 Feb 2022 18:18:40 GMT LH:Runner:warn FontSize gatherer, required by audit font-size, did not run.\nThu, 10 Feb 2022 18:18:40 GMT LH:status Auditing: Links have descriptive text\nThu, 10 Feb 2022 18:18:40 GMT LH:Runner:warn AnchorElements gatherer, required by audit link-text, did not run.\nThu, 10 Feb 2022 18:18:40 GMT LH:status Auditing: Links are crawlable\nThu, 10 Feb 2022 18:18:40 GMT LH:Runner:warn AnchorElements gatherer, required by audit crawlable-anchors, did not run.\nThu, 10 Feb 2022 18:18:40 GMT LH:status Auditing: Page isn’t blocked from indexing\nThu, 10 Feb 2022 18:18:40 GMT LH:Runner:warn MetaElements gatherer, required by audit is-crawlable, did not run.\nThu, 10 Feb 2022 18:18:40 GMT LH:status Auditing: robots.txt is valid\nThu, 10 Feb 2022 18:18:40 GMT LH:Runner:warn RobotsTxt gatherer, required by audit robots-txt, did not run.\nThu, 10 Feb 2022 18:18:40 GMT LH:status Auditing: Tap targets are sized appropriately\nThu, 10 Feb 2022 18:18:40 GMT LH:Runner:warn MetaElements gatherer, required by audit tap-targets, did not run.\nThu, 10 Feb 2022 18:18:40 GMT LH:status Auditing: Document has a valid `hreflang`\nThu, 10 Feb 2022 18:18:40 GMT LH:Runner:warn LinkElements gatherer, required by audit hreflang, did not run.\nThu, 10 Feb 2022 18:18:40 GMT LH:status Auditing: Document avoids plugins\nThu, 10 Feb 2022 18:18:40 GMT LH:Runner:warn EmbeddedContent gatherer, required by audit plugins, did not run.\nThu, 10 Feb 2022 18:18:40 GMT LH:status Auditing: Document has a valid `rel=canonical`\nThu, 10 Feb 2022 18:18:40 GMT LH:Runner:warn LinkElements gatherer, required by audit canonical, did not run.\nThu, 10 Feb 2022 18:18:40 GMT LH:status Auditing: Structured data is valid\nThu, 10 Feb 2022 18:18:40 GMT LH:status Generating results...\nThu, 10 Feb 2022 18:18:40 GMT LH:Printer json output written to /Users/bolajiayodeji/Tunnel/csc422_eval/report/polac_edu_ng_.report.json\nThu, 10 Feb 2022 18:18:40 GMT LH:Printer html output written to /Users/bolajiayodeji/Tunnel/csc422_eval/report/polac_edu_ng_.report.html\nThu, 10 Feb 2022 18:18:40 GMT LH:CLI Protip: Run lighthouse with `--view` to immediately open the HTML report in your browser\nThu, 10 Feb 2022 18:18:40 GMT LH:Printer csv output written to /Users/bolajiayodeji/Tunnel/csc422_eval/report/polac_edu_ng_.report.csv\nThu, 10 Feb 2022 18:18:40 GMT LH:ChromeLauncher Killing Chrome instance 8674\nRuntime error encountered: DNS servers could not resolve the provided domain.\n"
  },
  {
    "url": "https://naub.edu.ng/",
    "name": "naub_edu_ng_",
    "file": "naub_edu_ng_.report.json",
    "html": "naub_edu_ng_.report.html",
    "csv": "naub_edu_ng_.report.csv",
    "score": 0.67,
    "detail": {
      "performance": 0.39,
      "accessibility": 0.79,
      "best-practices": 0.87,
      "seo": 0.82,
      "pwa": 0.5
    }
  },
  {
    "url": "https://nda.edu.ng/",
    "name": "nda_edu_ng_",
    "file": "nda_edu_ng_.report.json",
    "html": "nda_edu_ng_.report.html",
    "csv": "nda_edu_ng_.report.csv",
    "score": 0.69,
    "detail": {
      "performance": 0.3,
      "accessibility": 0.96,
      "best-practices": 0.93,
      "seo": 0.75,
      "pwa": 0.5
    }
  },
  {
    "url": "https://nmu.edu.ng/",
    "name": "nmu_edu_ng_",
    "file": "nmu_edu_ng_.report.json",
    "html": "nmu_edu_ng_.report.html",
    "csv": "nmu_edu_ng_.report.csv",
    "score": 0.67,
    "detail": {
      "performance": 0.36,
      "accessibility": 0.91,
      "best-practices": 0.87,
      "seo": 0.7,
      "pwa": 0.5
    }
  },
  {
    "url": "https://unizik.edu.ng/",
    "name": "unizik_edu_ng_",
    "file": "unizik_edu_ng_.report.json",
    "html": "unizik_edu_ng_.report.html",
    "csv": "unizik_edu_ng_.report.csv",
    "score": 0.68,
    "detail": {
      "performance": 0.27,
      "accessibility": 0.96,
      "best-practices": 0.8,
      "seo": 0.89,
      "pwa": 0.5
    }
  },
  {
    "url": "https://oauife.edu.ng/",
    "name": "oauife_edu_ng_",
    "file": "oauife_edu_ng_.report.json",
    "html": "oauife_edu_ng_.report.html",
    "csv": "oauife_edu_ng_.report.csv",
    "score": 0.66,
    "detail": {
      "performance": 0.22,
      "accessibility": 0.95,
      "best-practices": 0.8,
      "seo": 0.83,
      "pwa": 0.5
    }
  },
  {
    "url": "https://fupreonline.com/",
    "name": "fupreonline_com_",
    "file": "fupreonline_com_.report.json",
    "html": "fupreonline_com_.report.html",
    "csv": "fupreonline_com_.report.csv",
    "score": 0.65,
    "detail": {
      "performance": 0.39,
      "accessibility": 0.8,
      "best-practices": 0.8,
      "seo": 0.83,
      "pwa": 0.42
    }
  },
  {
    "url": "https://futa.edu.ng/",
    "name": "futa_edu_ng_",
    "file": "futa_edu_ng_.report.json",
    "html": "futa_edu_ng_.report.html",
    "csv": "futa_edu_ng_.report.csv",
    "score": 0.57,
    "detail": {
      "performance": 0.3,
      "accessibility": 0.8,
      "best-practices": 0.6,
      "seo": 0.8,
      "pwa": 0.33
    }
  },
  {
    "url": "https://futminna.edu.ng/",
    "name": "futminna_edu_ng_",
    "file": "futminna_edu_ng_.report.json",
    "html": "futminna_edu_ng_.report.html",
    "csv": "futminna_edu_ng_.report.csv",
    "score": 0.61,
    "detail": {
      "performance": 0.18,
      "accessibility": 0.87,
      "best-practices": 0.6,
      "seo": 0.91,
      "pwa": 0.5
    }
  },
  {
    "url": "https://mautech.edu.ng/new/",
    "name": "mautech_edu_ng_new_",
    "file": "mautech_edu_ng_new_.report.json",
    "html": "mautech_edu_ng_new_.report.html",
    "csv": "mautech_edu_ng_new_.report.csv",
    "score": 0.55,
    "detail": {
      "performance": 0.44,
      "accessibility": 0.71,
      "best-practices": 0.6,
      "seo": 0.73,
      "pwa": 0.25
    }
  },
  {
    "url": "https://uniabuja.edu.ng/",
    "name": "uniabuja_edu_ng_",
    "file": "uniabuja_edu_ng_.report.json",
    "html": "uniabuja_edu_ng_.report.html",
    "csv": "uniabuja_edu_ng_.report.csv",
    "score": 0.71,
    "detail": {
      "performance": 0.52,
      "accessibility": 0.88,
      "best-practices": 0.93,
      "seo": 0.79,
      "pwa": 0.42
    }
  },
  {
    "url": "https://unn.edu.ng/",
    "name": "unn_edu_ng_",
    "file": "unn_edu_ng_.report.json",
    "html": "unn_edu_ng_.report.html",
    "csv": "unn_edu_ng_.report.csv",
    "score": 0.65,
    "detail": {
      "performance": 0.18,
      "accessibility": 0.83,
      "best-practices": 0.8,
      "seo": 0.93,
      "pwa": 0.5
    }
  },
  {
    "url": "https://uniben.edu.ng/",
    "name": "uniben_edu_ng_",
    "file": "uniben_edu_ng_.report.json",
    "html": "uniben_edu_ng_.report.html",
    "csv": "uniben_edu_ng_.report.csv",
    "score": 0.65,
    "detail": {
      "performance": 0.33,
      "accessibility": 0.93,
      "best-practices": 0.73,
      "seo": 0.85,
      "pwa": 0.42
    }
  },
  {
    "url": "https://unical.edu.ng/",
    "name": "unical_edu-ng_",
    "file": "unical_edu-ng_.report.json",
    "html": "unical_edu-ng_.report.html",
    "csv": "unical_edu-ng_.report.csv",
    "score": 0,
    "error": "Fri, 11 Feb 2022 12:55:47 GMT LH:ChromeLauncher Waiting for browser.\nFri, 11 Feb 2022 12:55:47 GMT LH:ChromeLauncher Waiting for browser...\nFri, 11 Feb 2022 12:55:48 GMT LH:ChromeLauncher Waiting for browser.....\nFri, 11 Feb 2022 12:55:48 GMT LH:ChromeLauncher Waiting for browser.....\u001b[32m✓\u001b[0m\nFri, 11 Feb 2022 12:55:48 GMT LH:config:warn IFrameElements gatherer requested, however no audit requires it.\nFri, 11 Feb 2022 12:55:48 GMT LH:config:warn FormElements gatherer requested, however no audit requires it.\nFri, 11 Feb 2022 12:55:48 GMT LH:status Connecting to browser\nFri, 11 Feb 2022 12:55:48 GMT LH:status Resetting state with about:blank\nFri, 11 Feb 2022 12:55:48 GMT LH:status Navigating to about:blank\nFri, 11 Feb 2022 12:55:48 GMT LH:status Benchmarking machine\nFri, 11 Feb 2022 12:55:49 GMT LH:status Initializing…\nFri, 11 Feb 2022 12:55:49 GMT LH:status Preparing target for navigation mode\nFri, 11 Feb 2022 12:55:49 GMT LH:status Running defaultPass pass CSSUsage, JsUsage, ViewportDimensions, ConsoleMessages, AnchorElements, ImageElements, LinkElements, MetaElements, ScriptElements, IFrameElements, FormElements, MainDocumentContent, GlobalListeners, AppCacheManifest, Doctype, DOMStats, OptimizedImages, PasswordInputsWithPreventedPaste, ResponseCompression, TagsBlockingFirstPaint, FontSize, EmbeddedContent, RobotsTxt, TapTargets, Accessibility, TraceElements, InspectorIssues, SourceMaps, FullPageScreenshot\nFri, 11 Feb 2022 12:55:49 GMT LH:status Resetting state with about:blank\nFri, 11 Feb 2022 12:55:49 GMT LH:status Navigating to about:blank\nFri, 11 Feb 2022 12:55:49 GMT LH:status Preparing target for navigation\nFri, 11 Feb 2022 12:55:49 GMT LH:status Cleaning origin data\nFri, 11 Feb 2022 12:55:49 GMT LH:status Cleaning browser cache\nFri, 11 Feb 2022 12:55:49 GMT LH:status Preparing network conditions\nFri, 11 Feb 2022 12:55:49 GMT LH:status Beginning devtoolsLog and trace\nFri, 11 Feb 2022 12:55:49 GMT LH:status Loading page & waiting for onload\nFri, 11 Feb 2022 12:55:49 GMT LH:status Navigating to https://www.unical.edu.ng/\nFri, 11 Feb 2022 12:56:34 GMT LH:waitFor:warn Timed out waiting for page load. Checking if page is hung...\nFri, 11 Feb 2022 12:56:34 GMT LH:status Gathering in-page: CSSUsage\nFri, 11 Feb 2022 12:56:34 GMT LH:status Gathering in-page: JsUsage\nFri, 11 Feb 2022 12:56:34 GMT LH:status Gathering in-page: ViewportDimensions\nFri, 11 Feb 2022 12:56:34 GMT LH:status Gathering in-page: ConsoleMessages\nFri, 11 Feb 2022 12:56:34 GMT LH:status Gathering in-page: AnchorElements\nFri, 11 Feb 2022 12:56:34 GMT LH:status Gathering in-page: ImageElements\nFri, 11 Feb 2022 12:56:34 GMT LH:status Gathering in-page: LinkElements\nFri, 11 Feb 2022 12:56:34 GMT LH:status Gathering in-page: MetaElements\nFri, 11 Feb 2022 12:56:34 GMT LH:status Gathering in-page: ScriptElements\nFri, 11 Feb 2022 12:56:34 GMT LH:status Gathering in-page: IFrameElements\nFri, 11 Feb 2022 12:56:34 GMT LH:status Gathering in-page: FormElements\nFri, 11 Feb 2022 12:56:34 GMT LH:status Gathering in-page: MainDocumentContent\nFri, 11 Feb 2022 12:56:34 GMT LH:status Gathering in-page: GlobalListeners\nFri, 11 Feb 2022 12:56:34 GMT LH:status Gathering in-page: AppCacheManifest\nFri, 11 Feb 2022 12:56:34 GMT LH:status Gathering in-page: Doctype\nFri, 11 Feb 2022 12:56:34 GMT LH:status Gathering in-page: DOMStats\nFri, 11 Feb 2022 12:56:34 GMT LH:status Gathering in-page: OptimizedImages\nFri, 11 Feb 2022 12:56:34 GMT LH:status Gathering in-page: PasswordInputsWithPreventedPaste\nFri, 11 Feb 2022 12:56:34 GMT LH:status Gathering in-page: ResponseCompression\nFri, 11 Feb 2022 12:56:34 GMT LH:status Gathering in-page: TagsBlockingFirstPaint\nFri, 11 Feb 2022 12:56:34 GMT LH:status Gathering in-page: FontSize\nFri, 11 Feb 2022 12:56:34 GMT LH:status Gathering in-page: EmbeddedContent\nFri, 11 Feb 2022 12:56:34 GMT LH:status Gathering in-page: RobotsTxt\nFri, 11 Feb 2022 12:56:34 GMT LH:status Gathering in-page: TapTargets\nFri, 11 Feb 2022 12:56:34 GMT LH:status Gathering in-page: Accessibility\nFri, 11 Feb 2022 12:56:34 GMT LH:status Gathering in-page: TraceElements\nFri, 11 Feb 2022 12:56:34 GMT LH:status Gathering in-page: InspectorIssues\nFri, 11 Feb 2022 12:56:34 GMT LH:status Gathering in-page: SourceMaps\nFri, 11 Feb 2022 12:56:34 GMT LH:status Gathering in-page: FullPageScreenshot\nFri, 11 Feb 2022 12:56:34 GMT LH:status Gathering trace\nFri, 11 Feb 2022 12:56:35 GMT LH:status Gathering devtoolsLog & network records\nFri, 11 Feb 2022 12:56:35 GMT LH:status Gathering: CSSUsage\nFri, 11 Feb 2022 12:58:17 GMT LH:status Disconnecting from browser...\nFri, 11 Feb 2022 12:58:17 GMT LH:status Cleaning origin data\nFri, 11 Feb 2022 12:58:17 GMT LH:ChromeLauncher Killing Chrome instance 58489\nRuntime error encountered: Waiting for DevTools protocol response has exceeded the allotted time. (Method: Runtime.evaluate)\nLHError: PROTOCOL_TIMEOUT\n    at Timeout.<anonymous> (/Users/bolajiayodeji/.nvm/versions/node/v15.0.1/lib/node_modules/lighthouse-batch/node_modules/lighthouse/lighthouse-core/gather/driver.js:342:21)\n    at listOnTimeout (node:internal/timers:555:17)\n    at processTimers (node:internal/timers:498:7)\n"
  },
  {
    "url": "https://ui.edu.ng/",
    "name": "ui_edu_ng_",
    "file": "ui_edu_ng_.report.json",
    "html": "ui_edu_ng_.report.html",
    "csv": "ui_edu_ng_.report.csv",
    "score": 0.53,
    "detail": {
      "performance": 0.59,
      "accessibility": 0.6,
      "best-practices": 0.67,
      "seo": 0.61,
      "pwa": 0.17
    }
  },
  {
    "url": "https://unilorin.edu.ng/",
    "name": "unilorin_edu_ng_",
    "file": "unilorin_edu_ng_.report.json",
    "html": "unilorin_edu_ng_.report.html",
    "csv": "unilorin_edu_ng_.report.csv",
    "score": 0.59,
    "detail": {
      "performance": 0.42,
      "accessibility": 0.61,
      "best-practices": 0.73,
      "seo": 0.71,
      "pwa": 0.5
    }
  },
  {
    "url": "https://unijos.edu.ng/",
    "name": "unijos_edu_ng_",
    "file": "unijos_edu_ng_.report.json",
    "html": "unijos_edu_ng_.report.html",
    "csv": "unijos_edu_ng_.report.csv",
    "score": 0.73,
    "detail": {
      "performance": 0.71,
      "accessibility": 0.94,
      "best-practices": 0.8,
      "seo": 0.8,
      "pwa": 0.42
    }
  },
  {
    "url": "https://unilag.edu.ng/",
    "name": "unilag_edu_ng_",
    "file": "unilag_edu_ng_.report.json",
    "html": "unilag_edu_ng_.report.html",
    "csv": "unilag_edu_ng_.report.csv",
    "score": 0.52,
    "detail": {
      "performance": 0.01,
      "accessibility": 0.67,
      "best-practices": 0.8,
      "seo": 0.68,
      "pwa": 0.42
    }
  },
  {
    "url": "https://unimaid.edu.ng/",
    "name": "unimaid_edu_ng_",
    "file": "unimaid_edu_ng_.report.json",
    "html": "unimaid_edu_ng_.report.html",
    "csv": "unimaid_edu_ng_.report.csv",
    "score": 0.5,
    "detail": {
      "performance": 0.35,
      "accessibility": 0.61,
      "best-practices": 0.73,
      "seo": 0.64,
      "pwa": 0.17
    }
  },
  {
    "url": "https://uniport.edu.ng/",
    "name": "uniport_edu_ng_",
    "file": "uniport_edu_ng_.report.json",
    "html": "uniport_edu_ng_.report.html",
    "csv": "uniport_edu_ng_.report.csv",
    "score": 0.81,
    "detail": {
      "performance": 0.91,
      "accessibility": 0.92,
      "best-practices": 1,
      "seo": 0.82,
      "pwa": 0.42
    }
  },
  {
    "url": "https://uniuyo.edu.ng/",
    "name": "uniuyo_edu_ng_",
    "file": "uniuyo_edu_ng_.report.json",
    "html": "uniuyo_edu_ng_.report.html",
    "csv": "uniuyo_edu_ng_.report.csv",
    "score": 0.73,
    "detail": {
      "performance": 0.5,
      "accessibility": 0.9,
      "best-practices": 0.87,
      "seo": 0.87,
      "pwa": 0.5
    }
  },
  {
    "url": "https://udusok.edu.ng/",
    "name": "udusok_edu_ng_",
    "file": "udusok_edu_ng_.report.json",
    "html": "udusok_edu_ng_.report.html",
    "csv": "udusok_edu_ng_.report.csv",
    "score": 0.6,
    "detail": {
      "performance": 0.41,
      "accessibility": 0.69,
      "best-practices": 0.73,
      "seo": 0.67,
      "pwa": 0.5
    }
  },
  {
    "url": "https://fuhso.ng/",
    "name": "fuhso_ng_",
    "file": "fuhso_ng_.report.json",
    "html": "fuhso_ng_.report.html",
    "csv": "fuhso_ng_.report.csv",
    "score": 0.66,
    "detail": {
      "performance": 0.46,
      "accessibility": 0.92,
      "best-practices": 0.87,
      "seo": 0.74,
      "pwa": 0.33
    }
  },
  {
    "url": "https://fuaz.edu.ng/",
    "name": "fuaz_edu_ng_",
    "file": "fuaz_edu_ng_.report.json",
    "html": "fuaz_edu_ng_.report.html",
    "csv": "fuaz_edu_ng_.report.csv",
    "score": 0.69,
    "detail": {
      "performance": 0.44,
      "accessibility": 0.92,
      "best-practices": 0.8,
      "seo": 0.85,
      "pwa": 0.42
    }
  }
]
